404,888674437339033450,https://www.airbnb.com/rooms/888674437339033450,20241109184835,2024-11-09,city scrape,"Sunlit loft with fireplace, AC, and king bed","Welcome to your peaceful retreat in the heart of Bozeman, Montana! This bright and modern 800 square foot apartment is the perfect central hub for all your Bozeman-based activities. Enjoy the comfort of carefully curated furnishings, including many vintage and locally-sourced items that bring warmth and character to this newly-built space. Relax on the private deck with mountain views, or turn on the gas fireplace for a cozy evening.<br /><br />No checkout chores!",,https://a0.muscache.com/pictures/hosting/Hosting-888674437339033450/original/a46e5c87-4878-4668-b1d4-2a04d87ae043.jpeg,87352080,https://www.airbnb.com/users/show/87352080,Rebeccah,2016-08-01,"Bozeman, MT","I live and adventure in beautiful Bozeman, MT with my husband and four children. I'm happy to give recommendations for restaurants, activities, and great local spots to explore!",within an hour,100%,99%,t,https://a0.muscache.com/im/pictures/user/User-87352080/original/85f0837c-94bc-4d29-ba94-852b33851acb.jpeg?aki_policy=profile_small,https://a0.muscache.com/im/pictures/user/User-87352080/original/85f0837c-94bc-4d29-ba94-852b33851acb.jpeg?aki_policy=profile_x_medium,,1,1,"['email', 'phone']",t,t,,Bozeman,,45.68411,-111.08209,Entire rental unit,Entire home/apt,2,1.0,1 bath,1,1.0,"[""Refrigerator"", ""Private entrance"", ""Hangers"", ""Carbon monoxide alarm"", ""Outdoor dining area"", ""Free parking on premises"", ""Microwave"", ""Books and reading material"", ""Outdoor furniture"", ""Crib - available upon request"", ""Exterior security cameras on property"", ""Body soap"", ""TV"", ""Long term stays allowed"", ""Cleaning products"", ""Extra pillows and blankets"", ""Fire extinguisher"", ""Keypad"", ""Pack \u2019n play/Travel crib - available upon request"", ""Bed linens"", ""Hair dryer"", ""Fast wifi \u2013 105 Mbps"", ""Hot water kettle"", ""Essentials"", ""Self check-in"", ""Freezer"", ""Indoor fireplace: gas"", ""Dishwasher"", ""Dishes and silverware"", ""Dedicated workspace"", ""Coffee maker: drip coffee maker"", ""Toaster"", ""Clothing storage: closet"", ""Free washer \u2013 In unit"", ""Central heating"", ""Wine glasses"", ""Dining table"", ""Iron"", ""Free dryer \u2013 In unit"", ""Central air conditioning"", ""Coffee"", ""Hot water"", ""Conditioner"", ""Free street parking"", ""Smoke alarm"", ""Cooking basics"", ""Induction stove"", ""Private patio or balcony"", ""Shampoo"", ""Kitchen"", ""Room-darkening shades""]",$112.00,1,1125,1,1,1125,1125,1.0,1125.0,,t,22,51,81,83,2024-11-09,143,92,5,2023-05-19,2024-11-02,4.98,4.99,5.0,4.99,4.97,4.96,4.93,STR23-00048,f,1,1,0,0,7.93
405,894262572544681789,https://www.airbnb.com/rooms/894262572544681789,20241109184835,2024-11-09,city scrape,2 bedroom apt in the heart of downtown Bozeman,"Charming apt in the heart of vibrant downtown Bozeman.  Just steps away from amazing restaurants, cafes, bars, breweries, and unique shops.  Perfect getaway to explore all that the Bozeman area has to offer from world class summer (fly fishing, mountain biking, river rafting, and hiking) and winter (downhill skiing, x-country skiing, snow shoeing, ice climbing) recreational activities, to the wonders of Yellowstone National Park.<br />* Loft area is available for an additional sleeping.","This apt. is located in the heart of downtown Bozeman where the atmosphere is always lively and fun.  Downtown Bozeman is home to a variety of amazing restaurant's that cater to a range of tastes and preferences.  Galleries, unique boutiques and shopping galore just steps away from the apt.",https://a0.muscache.com/pictures/miso/Hosting-894262572544681789/original/e66015ce-1769-46de-9cbf-a60e9c9d48cc.jpeg,510216735,https://www.airbnb.com/users/show/510216735,Sharon,2023-04-15,,,within an hour,100%,99%,t,https://a0.muscache.com/im/pictures/user/453fe0b7-65a1-4441-9c76-985935ca2239.jpg?aki_policy=profile_small,https://a0.muscache.com/im/pictures/user/453fe0b7-65a1-4441-9c76-985935ca2239.jpg?aki_policy=profile_x_medium,,3,3,['phone'],t,t,Neighborhood highlights,Bozeman,,45.67738,-111.0384,Entire rental unit,Entire home/apt,4,1.0,1 bath,2,2.0,"[""Children\u2019s dinnerware"", ""Refrigerator"", ""Coffee maker: Keurig coffee machine"", ""Private entrance"", ""Hangers"", ""Laundromat nearby"", ""Carbon monoxide alarm"", ""Microwave"", ""Books and reading material"", ""Outdoor furniture"", ""Wifi"", ""Clothing storage"", ""Stove"", ""First aid kit"", ""Body soap"", ""TV"", ""Cleaning products"", ""Extra pillows and blankets"", ""BBQ grill"", ""Fire extinguisher"", ""Keypad"", ""Barbecue utensils"", ""Hair dryer"", ""Bed linens"", ""Hot water kettle"", ""Essentials"", ""Self check-in"", ""Freezer"", ""Fire pit"", ""Dishes and silverware"", ""Toaster"", ""Baking sheet"", ""Free washer \u2013 In unit"", ""Central heating"", ""Wine glasses"", ""Booster seat high chair - always at the listing"", ""Dining table"", ""Oven"", ""Iron"", ""Pack \u2019n play/Travel crib - always at the listing"", ""Free dryer \u2013 In unit"", ""Hot water"", ""Conditioner"", ""Free street parking"", ""Smoke alarm"", ""Cooking basics"", ""Free carport on premises \u2013 1 space"", ""Shampoo"", ""Kitchen"", ""Room-darkening shades""]",$141.00,2,14,1,2,14,14,2.0,14.0,,t,14,27,48,276,2024-11-09,73,52,2,2023-06-04,2024-10-14,4.99,4.93,5.0,4.95,4.99,4.99,4.92,STR23-20495,f,2,2,0,0,4.17
406,896384642712866578,https://www.airbnb.com/rooms/896384642712866578,20241109184835,2024-11-09,city scrape,•Bozeman Basecamp•,"Book with us to explore and experience Bozeman like a true Bozemanite! A 3-bed,2-bath home located in the heart of Bozeman. Ideal for friends, families, dogs or business! Enjoy the open living areas, relaxing backyard, Equipped kitchen for cooking and restful beds in each bedroom! Located right next to walk/bike to parks, eateries and shops.Only 55 mins to Big Sky, 29 mins to Bridger Bowl, 5 mins to Montana State, 1hr and 20 mins to Yellowstone. Our goal is for an stress-free and relaxing stay!","Centered in the Bozeman community, this family-friendly neighborhood offers a tranquil atmosphere perfect for residents of all ages. The streets are lined with well-maintained homes, each radiating a welcoming charm. A nearby elementary school adds convenience for families, with a delightful playground and park, providing a picturesque setting for outdoor activities and gatherings.",https://a0.muscache.com/pictures/f14866d4-4121-4a35-b219-6b499bb18d42.jpg,161765884,https://www.airbnb.com/users/show/161765884,Ben,2017-12-07,"Bozeman, MT",,within an hour,100%,97%,t,https://a0.muscache.com/im/pictures/user/a0115439-a356-4281-aebf-9a1a473e005c.jpg?aki_policy=profile_small,https://a0.muscache.com/im/pictures/user/a0115439-a356-4281-aebf-9a1a473e005c.jpg?aki_policy=profile_x_medium,,1,1,"['email', 'phone']",t,t,Neighborhood highlights,Bozeman,,45.68947,-111.072,Entire home,Entire home/apt,6,2.0,2 baths,3,4.0,"[""Refrigerator"", ""Coffee maker: Keurig coffee machine"", ""Private entrance"", ""Hangers"", ""Game console"", ""Carbon monoxide alarm"", ""Outdoor dining area"", ""Free parking on premises"", ""Fast wifi \u2013 216 Mbps"", ""Microwave"", ""Outdoor furniture"", ""Mountain view"", ""Exterior security cameras on property"", ""First aid kit"", ""Body soap"", ""Room-darkening shades"", ""TV"", ""Pets allowed"", ""Long term stays allowed"", ""Cleaning products"", ""Extra pillows and blankets"", ""BBQ grill"", ""Fire extinguisher"", ""Barbecue utensils"", ""Hair dryer"", ""Bed linens"", ""Hot water kettle"", ""Bathtub"", ""Essentials"", ""Smart lock"", ""Self check-in"", ""Freezer"", ""Dishwasher"", ""Shower gel"", ""Dishes and silverware"", ""Toaster"", ""Clothing storage: closet"", ""Baking sheet"", ""Free washer \u2013 In unit"", ""Private backyard \u2013 Fully fenced"", ""Central heating"", ""Wine glasses"", ""Dining table"", ""Iron"", ""Stainless steel single oven"", ""Free dryer \u2013 In unit"", ""Coffee"", ""Samsung stainless steel electric stove"", ""Hot water"", ""Ceiling fan"", ""Conditioner"", ""Free street parking"", ""Smoke alarm"", ""Cooking basics"", ""Private patio or balcony"", ""Shampoo"", ""Kitchen"", ""Ethernet connection""]",$200.00,2,28,2,2,1125,1125,2.0,1125.0,,t,7,22,52,130,2024-11-09,48,40,2,2023-07-22,2024-10-25,4.98,4.98,4.92,4.92,4.98,4.92,4.92,STR24-00005,t,1,1,0,0,3.02
407,896458716338470845,https://www.airbnb.com/rooms/896458716338470845,20241109184835,2024-11-09,city scrape,West side stay - 10 minutes to everywhere,"This is a great space for a Basecamp to your outdoor adventures here in Bozeman. Whether it’s skiing, fishing, or visiting family. <br />There’s extra space in the garage for storage or gear repairs. <br />I’m happy to give recommendations on the local attractions. <br />The room is spacious with a plush king sized bed and up stairs away from the main area in a shared home so you can expect a lot of privacy.<br />There’s also a set of friendly yet shy retired sled dogs around from time to time.",This is a quiet neighborhood full of families and mature landscaping making it a great place to walk with a cup of coffee. <br />There is a pond just a block east with a large park to enjoy one a walk.,https://a0.muscache.com/pictures/miso/Hosting-896458716338470845/original/9f1ca9a0-a12d-42bf-bf51-07f6fdffc85c.jpeg,247540892,https://www.airbnb.com/users/show/247540892,Shaun,2019-03-07,"Bozeman, MT","Hello! I moved to Bozeman after college and stayed for the skiing and the community that I've built here the last 18 years. I enjoy hockey, skiing, snowboarding, mountain biking and rafting. 
For work I am a Vacation Rental Real Estate Investor and Construction Remodeler. 
I grew up in Idaho about 5 hours from here.
In the fall I love to make a nice breakfast and watch College Game day to hear about all the college football games.",within an hour,100%,96%,f,https://a0.muscache.com/im/pictures/user/e8178564-7a11-4ccd-b928-81624d092f89.jpg?aki_policy=profile_small,https://a0.muscache.com/im/pictures/user/e8178564-7a11-4ccd-b928-81624d092f89.jpg?aki_policy=profile_x_medium,Valley West,5,6,"['email', 'phone']",t,f,Neighborhood highlights,Bozeman,,45.68036,-111.10201,Private room in home,Private room,2,1.0,1 private bath,1,1.0,"[""Refrigerator"", ""Luggage dropoff allowed"", ""Clothing storage: closet and dresser"", ""Hangers"", ""Carbon monoxide alarm"", ""Free parking on premises"", ""Microwave"", ""Rice maker"", ""Wifi"", ""Blender"", ""Mountain view"", ""Lockbox"", ""First aid kit"", ""Body soap"", ""Lock on bedroom door"", ""TV"", ""Coffee maker"", ""Long term stays allowed"", ""Extra pillows and blankets"", ""BBQ grill"", ""Fire extinguisher"", ""Barbecue utensils"", ""Hair dryer"", ""Hot water kettle"", ""Bathtub"", ""Essentials"", ""Self check-in"", ""Freezer"", ""Dishwasher"", ""Dishes and silverware"", ""Dedicated workspace"", ""Toaster"", ""Baking sheet"", ""Washer"", ""Central heating"", ""Gas stove"", ""Wine glasses"", ""Backyard"", ""Dining table"", ""Oven"", ""Free dryer \u2013 In unit"", ""Coffee"", ""Hot water"", ""Conditioner"", ""Smoke alarm"", ""Cooking basics"", ""Shampoo"", ""Kitchen""]",$97.00,2,31,2,2,31,31,2.0,31.0,,t,16,16,16,16,2024-11-09,23,15,0,2023-08-09,2024-10-06,4.83,4.78,4.87,4.78,4.91,4.74,4.87,STR23-00050,f,2,1,1,0,1.5
408,897144005237382808,https://www.airbnb.com/rooms/897144005237382808,20241109184835,2024-11-09,city scrape,The BeAll House,"Centrally-located, blocks from Main street this townhouse is a short walk to  explore downtown dining, shopping and entertainment.  Newly built, this luxury spot has everything you need!","Best of downtown on the edge of a residential area so you have easy access without the hustle and bustle while also maintaining the ability to get not the highway to drive out of town or walk to explore the city parks, trails and various districts.",https://a0.muscache.com/pictures/hosting/Hosting-U3RheVN1cHBseUxpc3Rpbmc6ODk3MTQ0MDA1MjM3MzgyODA4/original/9905573c-a7e4-4cde-a28a-491fa889621d.jpeg,6931340,https://www.airbnb.com/users/show/6931340,Indra,2013-06-15,"Bozeman, MT",We travel mostly for work but enjoy a chance to get a feel for local scene and appreciate good food and healthy happy people everywhere we are. ,within an hour,100%,100%,t,https://a0.muscache.com/im/users/6931340/profile_pic/1371488173/original.jpg?aki_policy=profile_small,https://a0.muscache.com/im/users/6931340/profile_pic/1371488173/original.jpg?aki_policy=profile_x_medium,,1,3,"['email', 'phone']",t,t,Neighborhood highlights,Bozeman,,45.68185,-111.03916,Entire townhouse,Entire home/apt,4,2.0,2 baths,2,2.0,"[""Children\u2019s dinnerware"", ""Refrigerator"", ""Fast wifi \u2013 294 Mbps"", ""Private entrance"", ""Hangers"", ""Carbon monoxide alarm"", ""Children\u2019s books and toys"", ""Outdoor dining area"", ""Stainless steel oven"", ""Free parking on premises"", ""Microwave"", ""Books and reading material"", ""Outdoor furniture"", ""Bosch stainless steel gas stove"", ""Blender"", ""Mountain view"", ""Cleaning available during stay"", ""Lockbox"", ""First aid kit"", ""Body soap"", ""TV"", ""Pets allowed"", ""Long term stays allowed"", ""Cleaning products"", ""Extra pillows and blankets"", ""Fire extinguisher"", ""Hair dryer"", ""City skyline view"", ""Bed linens"", ""Pack \u2019n play/Travel crib - available upon request"", ""Hot water kettle"", ""Essentials"", ""Self check-in"", ""Freezer"", ""Babysitter recommendations"", ""Shower gel"", ""Dishes and silverware"", ""Dedicated workspace"", ""Dishwasher"", ""Toaster"", ""Clothing storage: closet"", ""Baking sheet"", ""Fire pit"", ""Free washer \u2013 In unit"", ""Private backyard \u2013 Fully fenced"", ""Central heating"", ""Board games"", ""Wine glasses"", ""JBL Portable speaker  Bluetooth sound system"", ""Dining table"", ""Iron"", ""Free dryer \u2013 In unit"", ""Central air conditioning"", ""Coffee"", ""Hot water"", ""Ceiling fan"", ""Conditioner"", ""Free street parking"", ""Smoke alarm"", ""Cooking basics"", ""Private patio or balcony"", ""Shampoo"", ""Private hot tub - available all year, open 24 hours"", ""Kitchen"", ""Room-darkening shades""]",$399.00,1,1125,1,2,1125,1125,1.3,1125.0,,t,8,20,50,278,2024-11-09,27,17,1,2023-07-01,2024-10-13,5.0,4.96,4.93,5.0,5.0,4.93,4.74,STR22-00066,t,1,1,0,0,1.63
409,897810044993822991,https://www.airbnb.com/rooms/897810044993822991,20241109184835,2024-11-09,city scrape,Cozy Valley West Studio | Full Kitchen & Laundry,"Whether planning a weekend getaway or an extended stay, this cozy, well-equipped studio is your gateway to relaxation and adventure in Bozeman. Located in the idyllic Valley West neighborhood, enjoy free parking, stunning mountain views, and proximity to a picturesque pond and park. It offers a full kitchen, bathroom, comfy bed, and essentials to make you feel right at home. <br /><br />*Pet-friendly stay <br />*Dual washer/dryer<br />*Air conditioning unit<br />*Dedicated workspace and wifi<br />*Great neighborhood","The apartment is located in Valley West, one of Bozeman’s most desirable neighborhoods. It’s surrounded by trails, a large beautiful pond with mountains as the backdrop, and numerous lovely parks. It’s the perfect location for easy access to outdoor spaces!<br /><br />Bozeman is known as “the most livable place” for good reason. Enjoy world-renowned fly fishing, and stunning mountains for hiking, mountain biking, rock climbing, skiing, hunting, and backcountry exploring. Yellowstone National Park and abundant wildlife are also nearby. Don’t miss out on Bozeman’s city experience - explore the vibrant arts and culture scene with main street festivals, farmers markets, cultural centers, museums, symphonies, theaters, and art galleries.",https://a0.muscache.com/pictures/prohost-api/Hosting-897810044993822991/original/a931ba0c-c520-4d78-be2e-e3370289a2c2.jpeg,22366054,https://www.airbnb.com/users/show/22366054,Tessa,2014-10-10,"Bozeman, MT","Hi, I’m Tessa. Originally from Missouri, I’ve been in Bozeman since 2010. I'm a mom and Licensed Montana Property Manager (RRE-RPM-LIC-109282).  My husband, Sten, is an Architect. We adore Bozeman and love sharing it with our guests. We love hiking, biking, skiing, camping, riding motorcycles, traveling near and far, and meeting new people. We share our home with our two young children.",within an hour,100%,98%,t,https://a0.muscache.com/im/users/22366054/profile_pic/1412952918/original.jpg?aki_policy=profile_small,https://a0.muscache.com/im/users/22366054/profile_pic/1412952918/original.jpg?aki_policy=profile_x_medium,,17,19,"['email', 'phone', 'work_email']",t,t,Neighborhood highlights,Bozeman,,45.6798384,-111.1002558,Entire guesthouse,Entire home/apt,2,1.0,1 bath,1,1.0,"[""Refrigerator"", ""Luggage dropoff allowed"", ""Private entrance"", ""Portable fans"", ""Laundromat nearby"", ""Free parking on premises"", ""Microwave"", ""Wifi"", ""Mountain view"", ""Clothing storage"", ""Drying rack for clothing"", ""Stove"", ""Safe"", ""First aid kit"", ""Body soap"", ""TV"", ""Pets allowed"", ""Coffee maker"", ""Long term stays allowed"", ""Cleaning products"", ""Fire extinguisher"", ""Keypad"", ""Hair dryer"", ""Bed linens"", ""Hot water kettle"", ""Essentials"", ""Portable air conditioning"", ""Self check-in"", ""Freezer"", ""Shower gel"", ""Dishes and silverware"", ""Toaster"", ""Baking sheet"", ""Washer"", ""Single oven"", ""Central heating"", ""Wine glasses"", ""Dining table"", ""Free dryer \u2013 In unit"", ""Coffee"", ""Hot water"", ""Ceiling fan"", ""Conditioner"", ""Smoke alarm"", ""Cooking basics"", ""Shampoo"", ""Ethernet connection""]",$109.00,2,365,1,2,365,1125,1.7,990.5,,t,29,59,89,364,2024-11-09,23,17,1,2023-07-02,2024-10-12,4.96,4.91,4.96,4.83,4.91,4.91,4.7,STR24-00003,f,10,10,0,0,1.39
410,899125019892212651,https://www.airbnb.com/rooms/899125019892212651,20241109184835,2024-11-09,city scrape,Gorgeous Midtown Condo,"This 2 bedroom, 2 bathroom condo features 180-degree views of the Bridger Mountains. The oversized north-facing window baths the room in natural light. It has a full kitchen, living area, 1 king bed, 1 bunk bed, 2 showers, walk in closet, and laundry. Outdoor roof top entertaining space for guests. The condo is upstairs from Ponderosa social club, Ceremony salon and spa, and Bourbon BBQ. Walking distance from lots of local favorites including Freefall Brewery, The Elm, and Access Fitness.","The neighborhood has many food and entertainment options. Across the parking lot is Ceremony Salon and Spa and Audreys Pizza & Freefall Brewery. Walking distance to many local favorites including and The Elm music venue, Cats paw bar, Genuine Ice Cream, and Farmers Daughter breakfast cafe. There is also a two food truck parks a short walk away. Downtown is a short six block walk away, to a plethora of shopping and dining options!",https://a0.muscache.com/pictures/hosting/Hosting-U3RheVN1cHBseUxpc3Rpbmc6ODk5MTI1MDE5ODkyMjEyNjUx/original/e05c46ac-3ec2-4599-a6ca-dfd57c26cda8.jpeg,135567233,https://www.airbnb.com/users/show/135567233,Lycurgus,2017-06-17,"Bozeman, MT",,within an hour,100%,100%,t,https://a0.muscache.com/im/pictures/user/User-135567233/original/223482ae-ccd8-4f60-880f-365b96822055.jpeg?aki_policy=profile_small,https://a0.muscache.com/im/pictures/user/User-135567233/original/223482ae-ccd8-4f60-880f-365b96822055.jpeg?aki_policy=profile_x_medium,,1,1,"['email', 'phone']",t,t,Neighborhood highlights,Bozeman,,45.6877567,-111.0472078,Entire home,Entire home/apt,4,2.0,2 baths,2,3.0,"[""Children\u2019s dinnerware"", ""Refrigerator"", ""Private entrance"", ""Hangers"", ""Sonos Bluetooth sound system"", ""Carbon monoxide alarm"", ""Malin and Goetz shampoo"", ""Changing table - always at the listing"", ""Microwave"", ""Stainless steel oven"", ""Coffee maker: drip coffee maker, Keurig coffee machine"", ""Outdoor furniture"", ""Free parking on premises"", ""Blender"", ""Mountain view"", ""Cleaning available during stay"", ""Resort access"", ""First aid kit"", ""Pets allowed"", ""Long term stays allowed"", ""36 inch HDTV"", ""Cleaning products"", ""Extra pillows and blankets"", ""High chair"", ""Fire extinguisher"", ""Outlet covers"", ""Hair dryer"", ""Bed linens"", ""GE stainless steel gas stove"", ""Hot water kettle"", ""Pool table"", ""Shared patio or balcony"", ""Essentials"", ""Self check-in"", ""Freezer"", ""Dishwasher"", ""Shower gel"", ""Dishes and silverware"", ""Dedicated workspace"", ""Toaster"", ""Elevator"", ""Clothing storage: closet"", ""Baking sheet"", ""Free washer \u2013 In unit"", ""Central heating"", ""Board games"", ""Malin and Goetz body soap"", ""Record player"", ""Wine glasses"", ""Dining table"", ""EV charger - level 2"", ""Iron"", ""Pack \u2019n play/Travel crib - always at the listing"", ""Free dryer \u2013 In unit"", ""Central air conditioning"", ""Coffee"", ""Hot water"", ""Ceiling fan"", ""Bowling alley"", ""Malin and Goetz conditioner"", ""Fast wifi \u2013 142 Mbps"", ""Pocket wifi"", ""Smoke alarm"", ""Exercise equipment"", ""Valley view"", ""Cooking basics"", ""Free street parking"", ""Keypad"", ""Kitchen"", ""Room-darkening shades""]",$173.00,1,1125,1,2,1125,1125,1.0,1125.0,,t,7,20,22,238,2024-11-09,142,107,9,2023-06-16,2024-11-08,5.0,5.0,4.96,4.94,4.96,4.91,4.9,STR23-00155,t,1,1,0,0,8.3
412,901459145108835199,https://www.airbnb.com/rooms/901459145108835199,20241109184835,2024-11-09,city scrape,Downtown Charming & Cozy Casita - 3 BDRM,"This downtown 3-Bedroom charming casita has a unique western-vintage style and is conveniently located in the historic Cooper Park neighborhood in the heart of Bozeman. Take in the surrounding nature and parks within a 5-minute walk to downtown and a short drive to Bridger Bowl, Hyalite Canyon, the Madison River and many other outdoor recreation destinations. Cared for by Erin, a Superhost, you are sure to have the best stay possible!","Our house is located in the Cooper Park Historic District, which includes Colonial Revival and Queen Anne architecture. The streets are lined with leafy trees and cute bungalows, most of which are pre-war built.",https://a0.muscache.com/pictures/hosting/Hosting-U3RheVN1cHBseUxpc3Rpbmc6OTAxNDU5MTQ1MTA4ODM1MTk5/original/9588ae5c-f198-43bc-86a7-d9189258c537.jpeg,406871,https://www.airbnb.com/users/show/406871,Erin,2011-02-23,"Bozeman, MT","Hi! I'm originally from Texas, now living in Montana, working as a documentary photographer. I've traveled all over the world and have lived in Turkey, India, Iraq, and Afghanistan. I love traveling, meeting new people and trying new things. I have been a host and guest on airbnb since 2010, and have had some amazing experiences. I'm very clean and respectful, and I take care of other's homes like they were my own. I look forward to hosting you and / or staying at your home! ",within an hour,100%,100%,,https://a0.muscache.com/im/pictures/user/2cd6b961-0e48-495d-9fc4-db6e427a51b3.jpg?aki_policy=profile_small,https://a0.muscache.com/im/pictures/user/2cd6b961-0e48-495d-9fc4-db6e427a51b3.jpg?aki_policy=profile_x_medium,,4,9,"['email', 'phone', 'work_email']",t,t,Neighborhood highlights,Bozeman,,45.67832,-111.04884,Entire home,Entire home/apt,6,1.0,1 bath,3,5.0,"[""Radiant heating"", ""Refrigerator"", ""Clothing storage: closet and dresser"", ""Portable fans"", ""Hangers"", ""Private entrance"", ""Luggage dropoff allowed"", ""Laundromat nearby"", ""Carbon monoxide alarm"", ""Outdoor dining area"", ""Stainless steel oven"", ""Free parking on premises"", ""Microwave"", ""Books and reading material"", ""Outdoor furniture"", ""Wifi"", ""Exterior security cameras on property"", ""First aid kit"", ""Body soap"", ""30 inch HDTV with Amazon Prime Video, HBO Max, Hulu, Netflix"", ""Pets allowed"", ""Long term stays allowed"", ""Cleaning products"", ""Extra pillows and blankets"", ""Fire extinguisher"", ""Hair dryer"", ""Bed linens"", ""Shared patio or balcony"", ""Hot water kettle"", ""Bathtub"", ""Essentials"", ""Smart lock"", ""Standalone high chair - available upon request"", ""Self check-in"", ""Freezer"", ""Indoor fireplace: gas"", ""Shower gel"", ""Dishes and silverware"", ""Dedicated workspace"", ""Toaster"", ""Fire pit"", ""Baking sheet"", ""Board games"", ""Wine glasses"", ""Dining table"", ""Coffee maker: drip coffee maker, french press"", ""Pack \u2019n play/Travel crib - always at the listing"", ""Electric stove"", ""Coffee"", ""Hot water"", ""Conditioner"", ""Children\u2019s books and toys for ages 2-5 years old"", ""Smoke alarm"", ""Cooking basics"", ""Shared backyard \u2013 Fully fenced"", ""Shampoo"", ""Kitchen""]",$234.00,2,30,1,1,1125,1125,1.0,1125.0,,t,21,42,66,277,2024-11-09,20,14,0,2023-06-05,2024-09-11,4.9,4.9,5.0,4.95,4.9,5.0,4.9,STR23-00164,t,3,3,0,0,1.15
