,id,listing_url,scrape_id,last_scraped,source,name,description,neighborhood_overview,picture_url,host_id,host_url,host_name,host_since,host_location,host_about,host_response_time,host_response_rate,host_acceptance_rate,host_is_superhost,host_thumbnail_url,host_picture_url,host_neighbourhood,host_listings_count,host_total_listings_count,host_verifications,host_has_profile_pic,host_identity_verified,neighbourhood,neighbourhood_cleansed,neighbourhood_group_cleansed,latitude,longitude,property_type,room_type,accommodates,bathrooms,bathrooms_text,bedrooms,beds,amenities,price,minimum_nights,maximum_nights,minimum_minimum_nights,maximum_minimum_nights,minimum_maximum_nights,maximum_maximum_nights,minimum_nights_avg_ntm,maximum_nights_avg_ntm,calendar_updated,has_availability,availability_30,availability_60,availability_90,availability_365,calendar_last_scraped,number_of_reviews,number_of_reviews_ltm,number_of_reviews_l30d,first_review,last_review,review_scores_rating,review_scores_accuracy,review_scores_cleanliness,review_scores_checkin,review_scores_communication,review_scores_location,review_scores_value,license,instant_bookable,calculated_host_listings_count,calculated_host_listings_count_entire_homes,calculated_host_listings_count_private_rooms,calculated_host_listings_count_shared_rooms,reviews_per_month
1,1913774,https://www.airbnb.com/rooms/1913774,20241109184835,2024-11-09,city scrape,Downtown Bozeman Vacation Rental,"Just four easy blocks from historic downtown Bozeman, this modern loft apartment is your perfect retreat. Enjoy a private loft, with modern amenities, just minutes from the best that Bozeman has to offer, shopping, fine dining, and nightlife.<br /><br />Need a vehicle rental? I’m happy to share my friend’s Turo link after booking. <br /><br />STR22-00028",,https://a0.muscache.com/pictures/9048a384-f2a5-408c-9f89-c2a9f9f87381.jpg,9892898,https://www.airbnb.com/users/show/9892898,Brian,2013-11-08,"Bozeman, MT","I'm a born and raised Montanan. I've done some traveling around the world and I just couldn't leave ""The Last Best Place"". I am a designer at A&E Design, a local Architecture and Design Firm. 

I live in the main house of the property with my black lab mix 'River'.  We spend a lot of our time outside on the river, slopes, hunting, camping, or hanging out in Historic Downtown Bozeman. 

We look forward to accommodating you and your adventure to this great town.",within an hour,100%,100%,t,https://a0.muscache.com/im/pictures/user/0c0127f3-b094-4e00-9475-856b88234808.jpg?aki_policy=profile_small,https://a0.muscache.com/im/pictures/user/0c0127f3-b094-4e00-9475-856b88234808.jpg?aki_policy=profile_x_medium,,2,2,"['email', 'phone', 'work_email']",t,t,,Bozeman,,45.68422,-111.03839,Entire guesthouse,Entire home/apt,2,1.0,1 bath,1,1.0,"[""Refrigerator"", ""Luggage dropoff allowed"", ""Coffee maker: Keurig coffee machine"", ""Private entrance"", ""Hangers"", ""Carbon monoxide alarm"", ""Outdoor dining area"", ""Free parking on premises"", ""Microwave"", ""Outdoor furniture"", ""Wifi"", ""Exterior security cameras on property"", ""First aid kit"", ""Long term stays allowed"", ""Cleaning products"", ""Extra pillows and blankets"", ""Fire extinguisher"", ""Hair dryer"", ""Bed linens"", ""Hot water kettle"", ""Kitchenette"", ""Essentials"", ""Smart lock"", ""Self check-in"", ""Shower gel"", ""Dishes and silverware"", ""Toaster"", ""Baking sheet"", ""Free washer \u2013 In unit"", ""Central heating"", ""Wine glasses"", ""55 inch HDTV with Amazon Prime Video, Disney+, Apple TV, HBO Max, Netflix, Hulu"", ""Iron"", ""Free dryer \u2013 In unit"", ""Central air conditioning"", ""Mini fridge"", ""Hot water"", ""Ceiling fan"", ""Conditioner"", ""Coffee"", ""Smoke alarm"", ""Cooking basics"", ""Private patio or balcony"", ""Shared backyard \u2013 Fully fenced"", ""Shampoo"", ""Room-darkening shades""]",$135.00,2,730,1,2,1125,1125,2.0,1125.0,,t,6,25,53,290,2024-11-09,524,72,5,2013-11-22,2024-10-19,4.97,4.98,4.95,4.97,4.99,4.93,4.94,STR22-00028,f,2,2,0,0,3.92
3,2390321,https://www.airbnb.com/rooms/2390321,20241109184835,2024-11-09,city scrape,2 Blocks 2 Main,"This space is designed for 1-2 people that want to sleep in the same bed.  More details are below in the space section.<br /><br />According to our local laws, I need to post my registration number and there is no place on this website to post it so decided to put it here - Registration #STR22-00083","I love that it is 2 blocks from the heart of downtown Bozeman where you will find a wonderful assortment of shops, restaurants, the city library, walking trails, and a park. A walking trail start just 1 block south that will take you by fields, wooded areas, creeks, and  a duck pond.  It is four blocks to the city library and one block to Bogert Park and the outdoor city pool.  Being a native of this area, I will be able to help you match your preferences regarding restaurants, activities, etc. to the huge array of options.  <br /><br />Bozeman and the surrounding area has so much to offer:  1.5 hours to Yellowstone Park, unending hiking and cross country ski trails, two top notch downhill ski areas with a total of 24 lifts and 222 named runs, world class fishing, golfing, everything from amazing sushi to one of the best steaks you will ever eat, great little shops with unique items, amazing chocolates and caramels made locally, the best shoe store ever, majestic mountains all around a",https://a0.muscache.com/pictures/31808170/767c0192_original.jpg,7849959,https://www.airbnb.com/users/show/7849959,Irene,2013-07-31,"Bozeman, MT","I have lived in or near Bozeman all of my life.  I purchased this home several years ago and raised my three children here and now that they are off on their own adventures, I would love to share this home with you and all this amazing area has to offer.",within an hour,100%,92%,t,https://a0.muscache.com/im/users/7849959/profile_pic/1392311847/original.jpg?aki_policy=profile_small,https://a0.muscache.com/im/users/7849959/profile_pic/1392311847/original.jpg?aki_policy=profile_x_medium,,2,2,"['email', 'phone']",t,f,Neighborhood highlights,Bozeman,,45.67434,-111.0333,Entire rental unit,Entire home/apt,2,1.0,1 bath,1,1.0,"[""Refrigerator"", ""Portable fans"", ""Hangers"", ""Carbon monoxide alarm"", ""Microwave"", ""Wifi"", ""Coffee maker"", ""Extra pillows and blankets"", ""Fire extinguisher"", ""Keypad"", ""Hair dryer"", ""Bed linens"", ""Bathtub"", ""Essentials"", ""Self check-in"", ""Dishes and silverware"", ""Heating"", ""Varies body soap"", ""Iron"", ""Coffee"", ""Hot water"", ""Free street parking"", ""Smoke alarm"", ""Air conditioning"", ""Shampoo"", ""TV with standard cable"", ""Ethernet connection""]",$175.00,3,3,3,3,3,3,3.0,3.0,,t,9,39,69,249,2024-11-09,49,6,0,2016-05-09,2024-09-02,4.96,5.0,5.0,5.0,4.98,5.0,4.73,STR22-00083,t,2,2,0,0,0.47
5,2839082,https://www.airbnb.com/rooms/2839082,20241109184835,2024-11-09,city scrape,"Charming downtown home, Bogart park","Location, location, location!  This home is located 3 blocks from downtown and 100 yards from Bogart park. Located at the top of historic Lindley street, this neighborhood is the best location for all your downtown Bozeman shopping and eating.<br /><br />Bozeman Hosting permit #313210","Walking distance to downtown, Petes hill, Bogart park farmers market and ice rink. Both Koch and Lindley are not through streets making this quite but still in the heart of downtown. Wonderful neighbors with a true sense of community",https://a0.muscache.com/pictures/61289180-8ba0-4dcb-8800-f81712c5dd58.jpg,1577112,https://www.airbnb.com/users/show/1577112,Zack,2012-01-07,"Bozeman, MT","I'm originally from Colorado and calling Bozeman Montana my home for the last 16 years.  My passions are skiing, fishing, camping, biking, live music and anything outdoors.  I am happy to share my home with respectful guest. The community here is amazing and I hope you get a taste of the quite, old bozeman.  I hope the location and space of my house serves as a home base for your time in Montana. ",within a day,100%,40%,f,https://a0.muscache.com/im/pictures/user/ca568c93-83e7-4de2-970f-5cb184fc2cec.jpg?aki_policy=profile_small,https://a0.muscache.com/im/pictures/user/ca568c93-83e7-4de2-970f-5cb184fc2cec.jpg?aki_policy=profile_x_medium,,1,1,"['email', 'phone']",t,t,Neighborhood highlights,Bozeman,,45.6757,-111.03284,Entire home,Entire home/apt,4,1.0,1 bath,2,2.0,"[""Refrigerator"", ""Clothing storage: closet and dresser"", ""Portable fans"", ""Hangers"", ""Private entrance"", ""Carbon monoxide alarm"", ""Outdoor dining area"", ""Free parking on premises"", ""Microwave"", ""Books and reading material"", ""Rice maker"", ""Outdoor furniture"", ""Wifi"", ""Blender"", ""Exterior security cameras on property"", ""Body soap"", ""Pack \u2019n play/Travel crib"", ""Coffee maker"", ""Long term stays allowed"", ""Bidet"", ""Cleaning products"", ""Extra pillows and blankets"", ""Fireplace guards"", ""BBQ grill"", ""Fire extinguisher"", ""Keypad"", ""Barbecue utensils"", ""Hair dryer"", ""Bed linens"", ""Hot water kettle"", ""Bathtub"", ""Dryer"", ""Essentials"", ""Window AC unit"", ""Self check-in"", ""Freezer"", ""Indoor fireplace: gas"", ""Shower gel"", ""Dishes and silverware"", ""Dedicated workspace"", ""Dishwasher"", ""Toaster"", ""Heating"", ""Baking sheet"", ""Washer"", ""Gas stove"", ""Board games"", ""Sound system"", ""Dining table"", ""Oven"", ""Iron"", ""Crib"", ""Coffee"", ""Hot water"", ""Conditioner"", ""Free street parking"", ""Smoke alarm"", ""Cooking basics"", ""Private patio or balcony"", ""Shared backyard \u2013 Fully fenced"", ""55 inch HDTV with standard cable"", ""Shampoo"", ""Kitchen"", ""Room-darkening shades""]",$514.00,90,180,90,90,180,180,90.0,180.0,,t,0,0,0,101,2024-11-09,69,2,0,2015-12-16,2024-08-21,4.97,4.94,4.99,4.98,5.0,5.0,4.74,STR21-00060,f,1,1,0,0,0.64
6,2968623,https://www.airbnb.com/rooms/2968623,20241109184835,2024-11-09,city scrape,Sunny Bozeman MSU Cottage,"#STR23-00143<br /><br />Our bright and open Mother-in-Law unit is newly remodeled and in a great location in Bozeman. You can walk or bike to downtown, MSU, neighborhood parks, trails, coffee shops and restaurants. Easy drive to Yellowstone Park and much more to explore.","At the cottage you are a few blocks from MSU campus, Joe's Parkway Grocery, Pickle Barrel sandwiches AND Ice Cream shop, 2 coffee shops, and the AWESOME Columbo Pizza place. Neighborhood parks - Cooper Park and Southside Park- are also a few blocks away.",https://a0.muscache.com/pictures/miso/Hosting-2968623/original/4ff94439-0639-42a4-821f-524006c1116e.jpeg,15146634,https://www.airbnb.com/users/show/15146634,Frances,2014-05-05,"Bozeman, MT","I am a mother of 2 who enjoys to cook and play outside. I love my neighborhood and would not want to live anywhere else in Bozeman- and trust me I have looked but this is the place for me! 
Both my husband and I are from the East coast and travel back as often as possible. 
I love the warm season here and my husband loves the cold-you will get plenty of input from us if you need suggestions on what to do. ",within a few hours,100%,95%,t,https://a0.muscache.com/im/pictures/user/f58665cd-b17c-4580-9b1a-c2ac4e4b4c83.jpg?aki_policy=profile_small,https://a0.muscache.com/im/pictures/user/f58665cd-b17c-4580-9b1a-c2ac4e4b4c83.jpg?aki_policy=profile_x_medium,,1,2,"['email', 'phone']",t,t,Neighborhood highlights,Bozeman,,45.67241,-111.04913,Entire guesthouse,Entire home/apt,4,1.0,1 bath,1,2.0,"[""Children\u2019s dinnerware"", ""Refrigerator"", ""Private entrance"", ""Portable fans"", ""Hangers"", ""Children\u2019s books and toys"", ""Outdoor dining area"", ""Free parking on premises"", ""I provide products that are considered \""clean\"" products body soap"", ""Air conditioning"", ""Microwave"", ""Outdoor furniture"", ""Wifi"", ""Stove"", ""TV with Amazon Prime Video, Roku, Netflix"", ""Long term stays allowed"", ""Cleaning products"", ""Extra pillows and blankets"", ""Fire extinguisher"", ""Keypad"", ""Hair dryer"", ""Bed linens"", ""Hot water kettle"", ""Essentials"", ""I provide \""clean\"" products conditioner"", ""Self check-in"", ""Shower gel"", ""Dishes and silverware"", ""Coffee maker: french press, Keurig coffee machine"", ""Toaster"", ""Heating"", ""Baking sheet"", ""Wine glasses"", ""Backyard"", ""Oven"", ""Iron"", ""Coffee"", ""Hot water"", ""Free street parking"", ""Smoke alarm"", ""Cooking basics"", ""Clothing storage: dresser"", ""Shampoo"", ""Kitchen""]",$125.00,2,1125,1,2,1125,1125,2.0,1125.0,,t,14,32,62,87,2024-11-09,199,24,1,2015-07-22,2024-10-11,4.94,4.94,4.83,4.98,4.98,4.94,4.88,STR23-00143,f,1,1,0,0,1.76
7,3372306,https://www.airbnb.com/rooms/3372306,20241109184835,2024-11-09,city scrape,Lovely 2BR Bozeman Cottage near Main St,"Note: 30 day minimum rentals only.<br />Welcome to my quaint and comfortable two bedroom Bozeman cottage! Walking distance to Main Street - enjoy restaurants, parks, nearby skiing and rivers, and unwind with a drink on the deck.","Great location! Only a few blocks walking distance to Main Street. I'd be happy to give you restaurant, bar and cafe recommendations. Bridger Bowl ski resort is 15 miles up the road, and Big Sky ski resort is about an hour away. Lots of hiking, biking and rivers to enjoy around Bozeman. The north entrance to Yellowstone National Park is around 1 1/2 hours away.",https://a0.muscache.com/pictures/miso/Hosting-3372306/original/d4d26f47-c4f6-4bda-9b6d-0e35e5a48dd7.jpeg,190138,https://www.airbnb.com/users/show/190138,Anna,2010-08-03,"San Francisco, CA","Avid cyclist, horse rider and skier. Favorite travel destinations: Costa Rica, Scandinavia, France, Italy, and the Rocky Mountains. ",within an hour,100%,91%,t,https://a0.muscache.com/im/users/190138/profile_pic/1403222766/original.jpg?aki_policy=profile_small,https://a0.muscache.com/im/users/190138/profile_pic/1403222766/original.jpg?aki_policy=profile_x_medium,,1,3,"['email', 'phone']",t,t,Neighborhood highlights,Bozeman,,45.68444,-111.04357,Entire home,Entire home/apt,4,1.0,1 bath,2,2.0,"[""Children\u2019s books and toys for ages 0-2 years old"", ""Refrigerator"", ""Luggage dropoff allowed"", ""Private entrance"", ""Portable fans"", ""Hangers"", ""Patio or balcony"", ""Carbon monoxide alarm"", ""Outdoor dining area"", ""Free parking on premises"", ""Microwave"", ""Outdoor furniture"", ""Crib - available upon request"", ""Wifi"", ""Indoor fireplace"", ""Drying rack for clothing"", ""Stove"", ""BBQ grill: gas"", ""TV"", ""Pets allowed"", ""Coffee maker"", ""Long term stays allowed"", ""Extra pillows and blankets"", ""Fire extinguisher"", ""Keypad"", ""Outlet covers"", ""Pack \u2019n play/Travel crib - available upon request"", ""Bed linens"", ""Hair dryer"", ""Barbecue utensils"", ""Bathtub"", ""Dryer"", ""Essentials"", ""Self check-in"", ""Freezer"", ""Dishwasher"", ""Shower gel"", ""Dishes and silverware"", ""Private backyard \u2013 Not fully fenced"", ""Toaster"", ""Heating"", ""Baking sheet"", ""Washer"", ""Wine glasses"", ""Dining table"", ""Oven"", ""Iron"", ""Coffee"", ""Hot water"", ""Conditioner"", ""Free street parking"", ""Smoke alarm"", ""Cooking basics"", ""Shampoo"", ""Kitchen""]",$149.00,30,1125,30,30,1125,1125,30.0,1125.0,,t,29,59,89,303,2024-11-09,71,4,1,2014-09-13,2024-10-18,4.89,4.97,4.92,4.96,4.97,4.97,4.87,,f,1,1,0,0,0.57
8,4008507,https://www.airbnb.com/rooms/4008507,20241109184835,2024-11-09,city scrape,"The Loft: near MSU, private entry, kitchen & baths","Our fun & sun-filled Loft has a private entrance, a  newly remodeled and well-stocked full kitchen, a bathroom with shower/tub, a queen & a twin bed, AC, a separate toilet area, a sofa/seating area & a TV with Prime/Netflix/Apple/Max - and an indoor swing! There is a Traeger BBQ & an outdoor dining table + two bikes, and a full washer/dryer & 2nd half bath in the garage. We have designated parking for Loft guests, and are just blocks from the university & historic downtown.    STR 22-00101","The Southside of Bozeman is the main historic district. It is composed of safe, and friendly neighborhoods lined with mature trees, and an eclectic array of architecture. From our home, it is only a few minute walk to MSU, a short bike ride or walk to the historic downtown. And just two blocks from our home is Bozeman's Southside Park, with a play ground for kids, plus tennis/pickle ball courts, and in the winter,  an ice skating rink.",https://a0.muscache.com/pictures/50407833/6450630b_original.jpg,20738079,https://www.airbnb.com/users/show/20738079,Lori,2014-08-30,"Bozeman, MT","We moved to Bozeman, Montana from Sonoma County in 2000 with a little kid, two dogs & a cat. The following decades were largely spent renovating this old 1920's home, while juggling all things young families juggle. Thankfully, things are finally slowing down.

Before joining AirBnB, we hosted international students and non-profit workers in ""The Loft"" - our  private entry guest space  - but have found hosting on AirBnB to be a great experience!",within an hour,100%,100%,t,https://a0.muscache.com/im/pictures/user/User-20738079/original/868733a1-6b95-4909-a6e2-5481420667b7.jpeg?aki_policy=profile_small,https://a0.muscache.com/im/pictures/user/User-20738079/original/868733a1-6b95-4909-a6e2-5481420667b7.jpeg?aki_policy=profile_x_medium,,2,2,"['email', 'phone']",t,t,Neighborhood highlights,Bozeman,,45.66932,-111.04256,Entire guest suite,Entire home/apt,3,1.0,1 bath,1,2.0,"[""Refrigerator"", ""Luggage dropoff allowed"", ""Private entrance"", ""Hangers"", ""Carbon monoxide alarm"", ""Children\u2019s books and toys"", ""Outdoor dining area"", ""Free parking on premises"", ""Microwave"", ""Free washer \u2013 In building"", ""Books and reading material"", ""Outdoor furniture"", ""Garden view"", ""Wifi"", ""Clothing storage"", ""Stove"", ""Courtyard view"", ""First aid kit"", ""Body soap"", ""Coffee maker"", ""Ethernet connection"", ""Long term stays allowed"", ""Cleaning products"", ""Extra pillows and blankets"", ""BBQ grill"", ""Fire extinguisher"", ""Keypad"", ""Barbecue utensils"", ""Hair dryer"", ""Bed linens"", ""Shared patio or balcony"", ""Hot water kettle"", ""Bathtub"", ""Essentials"", ""Portable air conditioning"", ""Window AC unit"", ""HDTV with Amazon Prime Video, Apple TV, HBO Max, Netflix"", ""Self check-in"", ""Freezer"", ""Dishwasher"", ""Shower gel"", ""Free dryer \u2013 In building"", ""Dedicated workspace"", ""Dishes and silverware"", ""Toaster"", ""Heating"", ""Baking sheet"", ""Private backyard \u2013 Fully fenced"", ""Wine glasses"", ""Sound system"", ""Dining table"", ""Oven"", ""Iron"", ""Bikes"", ""Coffee"", ""Hot water"", ""Ceiling fan"", ""Conditioner"", ""Pocket wifi"", ""Smoke alarm"", ""Exercise equipment"", ""Cooking basics"", ""Shampoo"", ""Kitchen"", ""Room-darkening shades""]",$200.00,2,1125,2,2,1125,1125,2.0,1125.0,,t,25,52,82,347,2024-11-09,264,42,4,2015-06-14,2024-11-02,4.99,4.99,4.97,4.99,4.99,4.99,4.95,STR22-00101,f,2,2,0,0,2.3
9,4134363,https://www.airbnb.com/rooms/4134363,20241109184835,2024-11-09,city scrape,Yellow Dogs Cottage: Unique Large Downtown Cottage,"Yellow Dogs Cottage is a Stylish and uniquely charming cottage is walking distance to Montana State University and town, close to skiing at Bridger Bowl & Big Sky, fishing, hiking, and so much more. Nestled in a lush, historic South-side neighborhood this cottage is thoughtfully and lovingly renovated and decorated. The cottage is always cleaned & sanitized between guests. One space flows into the next, making this a relaxing get-away spot.","Yellow Dogs Cottage<br />We think our neighborhood is the nicest in Bozeman. Here is where you will find most of the town's historic homes, including the Story Mansion just one block away. There is a wonderful, friendly atmosphere with a mix of locals, transplant families, and university students who all live in Bozeman for the amazing quality of life and accessibility to the incredible array of outdoor activities and beauty. MSU and downtown are each less than 10 minutes by foot. Hiking and biking trails are close by.",https://a0.muscache.com/pictures/miso/Hosting-4134363/original/02b0cbb6-3f42-4a61-9a18-c0f55c35bd48.jpeg,21447984,https://www.airbnb.com/users/show/21447984,Sharon,2014-09-17,"Bozeman, MT","I have had my home and cottage in Bozeman for over 20 years. During that time our family lived abroad in Lugano, Switzerland, and then Surrey, England for over 9 years, returning to our home once or twice a year to stay in touch with lovely Bozeman and our wonderful local friends. We are originally from Connecticut and have lots of family there that we visit regularly. I’ve been back in Bozeman full time for about 8 years and love all the many activities MT has to offer including skiing, snow shoeing, hiking, cycling, camping, tennis, pickleball, yoga  and so much more. 

I have two sons, one who graduated from the US Naval Academy Annapolis and is now a Marine Officer stationed at Camp Lejeune in North Carolina. The other graduated from University College London, England Medical School and is currently working as a doctor in London and is a competitive rower. 

I’m busy managing my rental properties located on the edge of the MSU campus and our lovely Yellow Dogs guest Cottage along with working as a Property Manager for others. 

Our Yellow Dogs are named Rumo & Tater.  You will occasionally see them playing and chasing balls in the fenced in backyard. 
",within an hour,100%,100%,f,https://a0.muscache.com/im/pictures/user/ada6c22f-fdc9-447e-99f8-c1adb5ff0937.jpg?aki_policy=profile_small,https://a0.muscache.com/im/pictures/user/ada6c22f-fdc9-447e-99f8-c1adb5ff0937.jpg?aki_policy=profile_x_medium,,3,3,"['email', 'phone']",t,t,Neighborhood highlights,Bozeman,,45.67114,-111.04041,Entire place,Entire home/apt,3,1.0,1 bath,1,2.0,"[""Shampoo"", ""Refrigerator"", ""Luggage dropoff allowed"", ""Private entrance"", ""Portable fans"", ""Hangers"", ""Laundromat nearby"", ""Carbon monoxide alarm"", ""Outdoor dining area"", ""Free parking on premises"", ""Hammock"", ""Microwave"", ""Books and reading material"", ""Outdoor furniture"", ""Garden view"", ""Wifi"", ""Cleaning available during stay"", ""Stove"", ""First aid kit"", ""Pack \u2019n play/Travel crib"", ""Pets allowed"", ""Coffee maker"", ""Long term stays allowed"", ""Cleaning products"", ""Extra pillows and blankets"", ""Fire extinguisher"", ""Keypad"", ""Hair dryer"", ""Bed linens"", ""Liquid   body soap"", ""Hot water kettle"", ""Clothing storage: wardrobe"", ""Essentials"", ""HDTV with premium cable, Netflix, Amazon Prime Video"", ""Window AC unit"", ""Indoor fireplace: wood-burning"", ""Self check-in"", ""Freezer"", ""Fire pit"", ""Shower gel"", ""Dishes and silverware"", ""Dedicated workspace"", ""Toaster"", ""Single level home"", ""Baking sheet"", ""Private backyard \u2013 Fully fenced"", ""Central heating"", ""Board games"", ""Wine glasses"", ""Dining table"", ""Oven"", ""Iron"", ""Varies conditioner"", ""Coffee"", ""Hot water"", ""Ceiling fan"", ""Free street parking"", ""Smoke alarm"", ""Cooking basics"", ""Private patio or balcony"", ""Game console: Nintendo Wii"", ""Kitchen""]",$235.00,3,120,1,3,1125,1125,3.0,1125.0,,t,23,29,59,215,2024-11-09,104,17,2,2014-11-15,2024-10-19,4.91,4.85,4.94,4.99,5.0,4.96,4.85,Exempt,f,3,3,0,0,0.86
