246,52809552,https://www.airbnb.com/rooms/52809552,20241109184835,2024-11-09,city scrape,Dwell Skyview,"Newly built in 2017 and already a favorite. Remote work haven in prime location, free/fast WiFi. Keyless self check-in. Smart TV.",,https://a0.muscache.com/pictures/prohost-api/Hosting-52809552/original/113abb8a-714a-4ce3-a74f-f2bb67199a5f.jpeg,8224408,https://www.airbnb.com/users/show/8224408,Paul,2013-08-17,"Bozeman, MT","I started Bozeman Cottage Vacation Rentals in 1998 which has now grown to 17 properties, mostly within walking distance from downtown Bozeman. I also work in renewable energy - solar thermal, permaculture, electric bikes, and biofuels - and strive to keep Bozeman Cottage low impact.  I stock the houses with non-toxic body products and cleaners, and are as efficient as possible with heating and cooling.  I also run a bicycle rental business so you can easily and affordably see Bozeman on 2-wheels!

Note: I manage a few different guest houses and reviews are shown collectively for all places. The few reservations that had to be cancelled over the years were mostly due to date conflicts when calendars failed to update automatically. The July 2016 reservation was cancelled when the guests revealed that they had two cats after using autobook, for which Airbnb charged me 100, so unfortunately I no longer use autobook.",within an hour,90%,99%,t,https://a0.muscache.com/im/pictures/user/f9efc11c-1d61-4d59-9536-629dd2ddd084.jpg?aki_policy=profile_small,https://a0.muscache.com/im/pictures/user/f9efc11c-1d61-4d59-9536-629dd2ddd084.jpg?aki_policy=profile_x_medium,,22,38,"['email', 'phone']",t,t,,Bozeman,,45.682308,-111.027911,Entire home,Entire home/apt,2,1.0,1 bath,1,1.0,"[""Refrigerator"", ""Private entrance"", ""Laundromat nearby"", ""Patio or balcony"", ""Carbon monoxide alarm"", ""Free parking on premises"", ""Microwave"", ""Books and reading material"", ""Wifi"", ""Mountain view"", ""Stove"", ""Pack \u2019n play/Travel crib"", ""TV"", ""Coffee maker"", ""Gym"", ""Fire extinguisher"", ""Hair dryer"", ""Bed linens"", ""Dryer"", ""Essentials"", ""Smart lock"", ""Self check-in"", ""Dishwasher"", ""Dishes and silverware"", ""Dedicated workspace"", ""Toaster"", ""Heating"", ""Washer"", ""Oven"", ""Iron"", ""Free street parking"", ""Smoke alarm"", ""Cooking basics"", ""Shampoo"", ""Kitchen""]",$147.00,3,1125,3,7,1125,1125,5.4,1125.0,,t,30,54,84,203,2024-11-09,15,4,0,2021-11-20,2024-04-29,5.0,5.0,5.0,5.0,5.0,5.0,4.87,str22-00017,f,21,21,0,0,0.41
250,53149809,https://www.airbnb.com/rooms/53149809,20241109184835,2024-11-09,city scrape,Midtown Retreat - Condo w/ great location for skii,Midtown Retreat - Cozy Condo in Bozeman's Midtown,,https://a0.muscache.com/pictures/prohost-api/Hosting-53149809/original/cd310d82-3285-4323-bedc-046a2d2cc224.jpeg,158595657,https://www.airbnb.com/users/show/158595657,Mountain Home,2017-11-13,"Bozeman, MT","Mountain Home is run by members of the local community, fully owned by locals, and boasts a track record of over two decades in operation. This is advantageous for you, as we possess an in-depth understanding of the region and a profound familiarity with all our vacation rentals in Montana.",within an hour,97%,100%,t,https://a0.muscache.com/im/pictures/user/556be290-e017-4df5-871c-70a836bf759e.jpg?aki_policy=profile_small,https://a0.muscache.com/im/pictures/user/556be290-e017-4df5-871c-70a836bf759e.jpg?aki_policy=profile_x_medium,Cameron,111,196,"['email', 'phone']",t,t,,Bozeman,,45.687916,-111.044533,Entire condo,Entire home/apt,4,1.0,1 bath,1,2.0,"[""Refrigerator"", ""Private entrance"", ""Hangers"", ""Carbon monoxide alarm"", ""Free parking on premises"", ""Microwave"", ""Wifi"", ""Stove"", ""TV"", ""Coffee maker"", ""Fire extinguisher"", ""Keypad"", ""Hair dryer"", ""Bed linens"", ""Hot water kettle"", ""Essentials"", ""Self check-in"", ""Freezer"", ""Dishwasher"", ""Dishes and silverware"", ""Dedicated workspace"", ""Toaster"", ""Heating"", ""Free washer \u2013 In unit"", ""Dining table"", ""Oven"", ""Free dryer \u2013 In unit"", ""Central air conditioning"", ""Mini fridge"", ""Smoke alarm"", ""Cooking basics"", ""Shampoo"", ""Kitchen""]",$260.00,1,1125,1,3,3,1125,2.9,62.5,,t,26,56,83,358,2024-11-09,26,8,0,2022-02-13,2024-10-06,4.92,4.92,4.96,4.73,4.77,4.81,4.81,STR22-00106,t,41,41,0,0,0.78
251,53151215,https://www.airbnb.com/rooms/53151215,20241109184835,2024-11-09,city scrape,DOWNTOWN BOZEMAN Condo Monthly Rental,"NEW CONDO. This space includes contemporary finishes/interior decor. Aprox. 1,000 square feet. The building includes two restaurants accessible from the lobby. Sitting on the third floor, this unit has views looking at downtown Bozeman, with access to the roof with fire pits and stunning panoramic views of the Gallatin Valley. This unit has a fully equipped kitchen, 1 bedroom, 1 bathroom, washer/dryer in unit, with remote control blinds in both rooms.  Street parking. Monthly rentals only.",,https://a0.muscache.com/pictures/928d6792-371a-4505-998d-2ef9cf137425.jpg,417219481,https://www.airbnb.com/users/show/417219481,Olivia,2021-08-06,,,,,50%,f,https://a0.muscache.com/im/pictures/user/a5624f0f-d278-4356-9afe-c8be83a7d1ec.jpg?aki_policy=profile_small,https://a0.muscache.com/im/pictures/user/a5624f0f-d278-4356-9afe-c8be83a7d1ec.jpg?aki_policy=profile_x_medium,,1,1,"['email', 'phone']",t,f,,Bozeman,,45.67944,-111.03692,Entire condo,Entire home/apt,2,1.0,1 bath,1,0.0,"[""Dryer"", ""Refrigerator"", ""First aid kit"", ""TV"", ""Pets allowed"", ""Carbon monoxide alarm"", ""Hot water"", ""Dishes and silverware"", ""Air conditioning"", ""Smoke alarm"", ""Heating"", ""Wifi"", ""Washer"", ""Hair dryer"", ""Kitchen""]",$175.00,30,365,30,30,1125,1125,30.0,1125.0,,t,3,33,63,85,2024-11-09,1,0,0,2022-09-02,2022-09-02,5.0,5.0,5.0,5.0,5.0,5.0,5.0,,t,1,1,0,0,0.04
252,53281258,https://www.airbnb.com/rooms/53281258,20241109184835,2024-11-09,city scrape,Luxury at it's best! King 1 bed studio Super Host!,"Best of the best in this new construction studio condo set on 7th street!  ""Festival Street"" in front of the brand new Aspen Crossing Building!  Walking distance to shopping, coffee, breweries!  Enjoy ""Bourbon"" restaurant in lower level of building.<br />Private roof top access for guests only.  Outstanding 360 views of the Bridger Mountains, the ""M"", and all of Bozeman!<br />Beautifully decorated with all high-end linens and bedding.  Fully stocked kitchen for those ""night ins""",This condo is perfectly located in the heart of Bozeman!  5 walking blocks from main street.,https://a0.muscache.com/pictures/922199f4-83f7-4da7-8e32-a3a36a0169e8.jpg,225774632,https://www.airbnb.com/users/show/225774632,Joe And Michelle,2018-11-14,,,within an hour,100%,99%,t,https://a0.muscache.com/im/pictures/user/64b79756-cc42-4301-859c-69c584fc2f2c.jpg?aki_policy=profile_small,https://a0.muscache.com/im/pictures/user/64b79756-cc42-4301-859c-69c584fc2f2c.jpg?aki_policy=profile_x_medium,,7,9,"['email', 'phone']",t,f,Neighborhood highlights,Bozeman,,45.68692,-111.04542,Entire condo,Entire home/apt,2,1.0,1 bath,0,1.0,"[""65 inch HDTV"", ""Refrigerator"", ""Private entrance"", ""Hangers"", ""Carbon monoxide alarm"", ""Outdoor dining area"", ""Free parking on premises"", ""Outdoor furniture"", ""Wifi"", ""Mountain view"", ""First aid kit"", ""Coffee maker"", ""BBQ grill"", ""Fire extinguisher"", ""Keypad"", ""Hair dryer"", ""Essentials"", ""EV charger"", ""Self check-in"", ""Fire pit"", ""Dishes and silverware"", ""Dedicated workspace"", ""Elevator"", ""Breakfast"", ""Heating"", ""Free washer \u2013 In unit"", ""Iron"", ""Free dryer \u2013 In unit"", ""Central air conditioning"", ""Smoke alarm"", ""Cooking basics"", ""Valley view"", ""Shampoo"", ""Kitchen""]",$233.00,2,1125,2,2,1125,1125,2.0,1125.0,,t,30,60,90,363,2024-11-09,29,17,1,2021-12-12,2024-10-13,4.97,5.0,5.0,5.0,5.0,4.9,4.97,STR23-00080,f,3,3,0,0,0.82
253,53344108,https://www.airbnb.com/rooms/53344108,20241109184835,2024-11-09,city scrape,Apartment close to Downtown Bozeman .| MSU,"We put an emphasis on keeping our home extremely clean and make sure we have an easy checkout for our guests. This accommodation is 1 mile from MSU, and within miles of groceries, pizza, coffee, downtown Bozeman and other food/drink venues. Freshly remodeled with updated finishes, comfy bedding, and fast internet. The unit is the perfect getaway for those looking to enjoy what Bozeman has to offer or work remotely. Not to mention it is only 17 miles to Bridger Bowl!","The midtown neighborhood is quiet and very safe. We see very little traffic on this street and our neighbors are all very friendly. We are close to all of the amenities including: grocery stores, restaurants, breweries, downtown Bozeman, main street, and food trucks.",https://a0.muscache.com/pictures/miso/Hosting-53344108/original/49ec7102-b4ed-4ceb-80d3-0e9630572438.jpeg,243371257,https://www.airbnb.com/users/show/243371257,Travis,2019-02-15,"Bozeman, MT",My wife and I love the outdoors and enjoy all that the Gallatin Valley has to offer. I specialize in outdoor media and video editing.,within an hour,100%,99%,,https://a0.muscache.com/im/pictures/user/fc586720-3999-4ad5-9317-a6ac071ba311.jpg?aki_policy=profile_small,https://a0.muscache.com/im/pictures/user/fc586720-3999-4ad5-9317-a6ac071ba311.jpg?aki_policy=profile_x_medium,,7,9,"['email', 'phone', 'work_email']",t,t,Neighborhood highlights,Bozeman,,45.68203,-111.05148,Entire home,Entire home/apt,4,1.0,1 bath,2,3.0,"[""Refrigerator"", ""Private entrance"", ""Portable fans"", ""Hangers"", ""Shared backyard \u2013 Not fully fenced"", ""Laundromat nearby"", ""Carbon monoxide alarm"", ""Free parking on premises"", ""Microwave"", ""Books and reading material"", ""Wifi"", ""Clothing storage"", ""Exterior security cameras on property"", ""Body soap"", ""Coffee maker"", ""Long term stays allowed"", ""Fire extinguisher"", ""Keypad"", ""Hair dryer"", ""Bed linens"", ""Hot water kettle"", ""Bathtub"", ""Essentials"", ""Whirlpool stainless steel gas stove"", ""Self check-in"", ""Freezer"", ""Dishwasher"", ""Dishes and silverware"", ""Single level home"", ""48 inch HDTV with Roku"", ""Heating"", ""Baking sheet"", ""Free washer \u2013 In unit"", ""Wine glasses"", ""Dining table"", ""Oven"", ""Iron"", ""Free dryer \u2013 In unit"", ""Coffee"", ""Hot water"", ""Conditioner"", ""Pocket wifi"", ""Free street parking"", ""Smoke alarm"", ""Cooking basics"", ""Private patio or balcony"", ""Shampoo"", ""Kitchen"", ""Room-darkening shades""]",$135.00,30,1125,27,30,1125,1125,27.2,1125.0,,t,6,36,66,341,2024-11-09,92,1,0,2021-11-28,2024-05-31,4.84,4.83,4.93,4.97,4.92,4.84,4.67,,t,1,1,0,0,2.56
254,53395300,https://www.airbnb.com/rooms/53395300,20241109184835,2024-11-09,city scrape,The Nest - Great Value! Cozy ADU Close To Downtown,Cozy ADU in Downtown Bozeman,,https://a0.muscache.com/pictures/prohost-api/Hosting-53395300/original/97b0cddb-4cf3-4167-970c-48d5afc87804.jpeg,158595657,https://www.airbnb.com/users/show/158595657,Mountain Home,2017-11-13,"Bozeman, MT","Mountain Home is run by members of the local community, fully owned by locals, and boasts a track record of over two decades in operation. This is advantageous for you, as we possess an in-depth understanding of the region and a profound familiarity with all our vacation rentals in Montana.",within an hour,97%,100%,t,https://a0.muscache.com/im/pictures/user/556be290-e017-4df5-871c-70a836bf759e.jpg?aki_policy=profile_small,https://a0.muscache.com/im/pictures/user/556be290-e017-4df5-871c-70a836bf759e.jpg?aki_policy=profile_x_medium,Cameron,111,196,"['email', 'phone']",t,t,,Bozeman,,45.683842,-111.039383,Entire rental unit,Entire home/apt,2,1.0,1 bath,1,1.0,"[""Refrigerator"", ""Private entrance"", ""Hangers"", ""Patio or balcony"", ""Carbon monoxide alarm"", ""Free parking on premises"", ""Microwave"", ""Wifi"", ""Stove"", ""TV"", ""Coffee maker"", ""Fire extinguisher"", ""Keypad"", ""Hair dryer"", ""Bed linens"", ""Hot water kettle"", ""Bathtub"", ""Essentials"", ""Self check-in"", ""Freezer"", ""Dishes and silverware"", ""Dedicated workspace"", ""Toaster"", ""Heating"", ""Free washer \u2013 In unit"", ""Dining table"", ""Oven"", ""Free dryer \u2013 In unit"", ""AC - split type ductless system"", ""Mini fridge"", ""Smoke alarm"", ""Cooking basics"", ""Shampoo"", ""Kitchen""]",$245.00,1,1125,1,3,3,1125,2.8,138.3,,t,29,33,61,336,2024-11-09,24,6,1,2021-12-20,2024-11-03,4.38,4.54,4.58,4.58,4.5,4.75,4.25,STR22-00093,t,41,41,0,0,0.68
257,53607095,https://www.airbnb.com/rooms/53607095,20241109184835,2024-11-09,city scrape,Amazing Montana Decor Condo!,"Amazing, brand new studio condo in the heart of Bozeman in the new Aspen Crossing Bldg.  Beautifully decorated w/ modern Montana decor   New luxurious bedding, towels, furniture & fully stocked kitchen.  Walking distance to the new ""Elm"" music venue,  best restaurants, Audrey's famous pizza & brewery is next door.    Bourbon restaurant is conveniently located on the main floor of the building.   Bridger bowl is a quick 25 minute drive.  Big Sky is 45 minutes away .  Kick off  your boots & relax!","This beautiful condo sits on 7th Street overlooking the new Aspen ""festival street"".  This street in front will be closed off for music activities, dances, markets and special events.  Lighted beautifully at night!  City Brew Coffee across the street, countless restaurants, shopping and views of the Bridger Mountains!",https://a0.muscache.com/pictures/miso/Hosting-53607095/original/66ce287f-1e2d-4d9f-baf3-bd1efa4de219.jpeg,225774632,https://www.airbnb.com/users/show/225774632,Joe And Michelle,2018-11-14,,,within an hour,100%,99%,t,https://a0.muscache.com/im/pictures/user/64b79756-cc42-4301-859c-69c584fc2f2c.jpg?aki_policy=profile_small,https://a0.muscache.com/im/pictures/user/64b79756-cc42-4301-859c-69c584fc2f2c.jpg?aki_policy=profile_x_medium,,7,9,"['email', 'phone']",t,f,Neighborhood highlights,Bozeman,,45.68799,-111.04346,Entire condo,Entire home/apt,2,1.0,1 bath,1,1.0,"[""Costco body soap"", ""65 inch HDTV"", ""Refrigerator"", ""Coffee maker: Keurig coffee machine"", ""Hangers"", ""Private entrance"", ""Carbon monoxide alarm"", ""Free parking on premises"", ""Microwave"", ""Books and reading material"", ""Wifi"", ""Mountain view"", ""First aid kit"", ""Long term stays allowed"", ""Cleaning products"", ""Extra pillows and blankets"", ""Costco conditioner"", ""Fire extinguisher"", ""Keypad"", ""Hair dryer"", ""Bed linens"", ""Shared patio or balcony"", ""Hot water kettle"", ""Essentials"", ""EV charger"", ""Self check-in"", ""Freezer"", ""Dishwasher"", ""Shower gel"", ""Dishes and silverware"", ""Dedicated workspace"", ""Toaster"", ""Elevator"", ""Single level home"", ""Heating"", ""Baking sheet"", ""Breakfast"", ""Free washer \u2013 In unit"", ""AEG stainless steel gas stove"", ""Wine glasses"", ""Dining table"", ""Oven"", ""Iron"", ""Free dryer \u2013 In unit"", ""Central air conditioning"", ""Coffee"", ""Hot water"", ""Free street parking"", ""Smoke alarm"", ""Cooking basics"", ""Clothing storage: walk-in closet"", ""Shampoo"", ""Kitchen""]",$233.00,2,730,2,2,730,730,2.0,730.0,,t,30,53,83,355,2024-11-09,51,26,0,2021-12-31,2024-10-05,5.0,5.0,4.98,5.0,5.0,4.94,4.84,STR23-00081,f,3,3,0,0,1.46
258,53611532,https://www.airbnb.com/rooms/53611532,20241109184835,2024-11-09,previous scrape,Renovated Townhouse in the Heart of Bozeman,"Come feel at home amongst the mountains in this newly renovated 2 bedroom 1 bath townhome. Comfortably sleeps 4 with one queen bed and two twins. Enjoy streaming services including Netflix and Amazon Prime, Wi-Fi, as well as our guidebook full of local tips and recommendations.","Quiet midtown neighborhood close to downtown, as well as walking distance from midtown restaurants and bars.",https://a0.muscache.com/pictures/miso/Hosting-53611532/original/6eaa8091-25e5-488f-9adf-1c6a1920bcfa.jpeg,324665946,https://www.airbnb.com/users/show/324665946,James,2020-01-05,"Bozeman, MT",,within an hour,100%,100%,t,https://a0.muscache.com/im/pictures/user/fa9a7d54-7fb2-4069-9000-3a41bdf47082.jpg?aki_policy=profile_small,https://a0.muscache.com/im/pictures/user/fa9a7d54-7fb2-4069-9000-3a41bdf47082.jpg?aki_policy=profile_x_medium,,1,1,['phone'],t,t,Neighborhood highlights,Bozeman,,45.68934,-111.04311,Entire townhouse,Entire home/apt,4,,1 bath,2,,"[""Refrigerator"", ""Private entrance"", ""Portable fans"", ""Hangers"", ""Coffee maker: drip coffee maker, pour-over coffee"", ""Carbon monoxide alarm"", ""Free driveway parking on premises \u2013 1 space"", ""Microwave"", ""Books and reading material"", ""Wifi"", ""Blender"", ""Mountain view"", ""Drying rack for clothing"", ""First aid kit"", ""Body soap"", ""LG stainless steel oven"", ""Long term stays allowed"", ""Cleaning products"", ""Extra pillows and blankets"", ""BBQ grill"", ""Fire extinguisher"", ""Keypad"", ""Barbecue utensils"", ""Hair dryer"", ""Bed linens"", ""Hot water kettle"", ""Essentials"", ""Portable air conditioning"", ""Self check-in"", ""Freezer"", ""Stainless steel stove"", ""Shower gel"", ""Dishes and silverware"", ""Toaster"", ""Single level home"", ""Clothing storage: closet"", ""Baking sheet"", ""Free washer \u2013 In unit"", ""Central heating"", ""Board games"", ""Wine glasses"", ""Dining table"", ""Free dryer \u2013 In unit"", ""Coffee"", ""Hot water"", ""Ceiling fan"", ""Conditioner"", ""Free street parking"", ""HDTV with Netflix, Roku, Amazon Prime Video"", ""Smoke alarm"", ""Cooking basics"", ""Shampoo"", ""Kitchen"", ""Room-darkening shades""]",,3,31,3,3,1125,1125,3.0,1125.0,,t,0,0,0,189,2024-11-09,66,15,1,2022-05-24,2024-10-14,4.92,4.92,4.92,4.98,4.97,4.8,4.82,STR23-00098,t,1,1,0,0,2.2
260,53631171,https://www.airbnb.com/rooms/53631171,20241109184835,2024-11-09,city scrape,Lovely 3 Bedroom Condo Near MSU and Downtown #C,"This is a private, upstairs condo unit in the heart of Bozeman. It's only 5 minutes to downtown and 5 minutes to MSU and is furnished with stylish and modern decor. With three bedrooms and two full bathrooms, the space is used very nice. <br />Bridger Bowl Ski resort is about 30 minutes away, Big Sky is about an hour, and Yellowstone is 90 minutes to the West Entrance and North Entrance.","This unit is in an area where there's lots of shops, stores, restaurants, etc.",https://a0.muscache.com/pictures/miso/Hosting-53631171/original/749fd910-19dd-480d-9ef5-d2b70d22a751.jpeg,434235941,https://www.airbnb.com/users/show/434235941,Tuyet Ngan Thi,2021-12-01,"Bozeman, MT","The name I go by is ERIN, so call me that!  ",within an hour,100%,97%,t,https://a0.muscache.com/im/pictures/user/6a35a4f6-f33a-4992-a120-f9828d3221d7.jpg?aki_policy=profile_small,https://a0.muscache.com/im/pictures/user/6a35a4f6-f33a-4992-a120-f9828d3221d7.jpg?aki_policy=profile_x_medium,,3,5,"['email', 'phone']",t,t,Neighborhood highlights,Bozeman,,45.6756,-111.06407,Entire condo,Entire home/apt,6,2.0,2 baths,3,3.0,"[""Refrigerator"", ""Hangers"", ""Carbon monoxide alarm"", ""Free parking on premises"", ""Microwave"", ""Rice maker"", ""Wifi"", ""First aid kit"", ""Body soap"", ""TV"", ""Coffee maker"", ""Cleaning products"", ""Extra pillows and blankets"", ""Fire extinguisher"", ""Keypad"", ""Hair dryer"", ""Essentials"", ""Self check-in"", ""Dishwasher"", ""Dishes and silverware"", ""Dedicated workspace"", ""Washer"", ""Central heating"", ""Wine glasses"", ""Iron"", ""Free dryer \u2013 In unit"", ""Electric stove"", ""Coffee"", ""Hot water"", ""Conditioner"", ""Smoke alarm"", ""Cooking basics"", ""Air conditioning"", ""Shampoo"", ""Kitchen""]",$156.00,1,365,1,1,1125,1125,1.0,1125.0,,t,19,36,64,326,2024-11-09,80,39,3,2021-12-30,2024-11-02,4.84,4.96,4.91,4.93,4.93,4.84,4.74,Str23-00127,t,2,2,0,0,2.29
261,53663663,https://www.airbnb.com/rooms/53663663,20241109184835,2024-11-09,city scrape,Studio apartment sits above restaurants & bars,Keep it simple at this peaceful and centrally-located place. Within walking distance to mini bars and restaurants in midtown activities.,,https://a0.muscache.com/pictures/miso/Hosting-53663663/original/bb4eba78-9de6-448e-a207-d9fc8b32780e.jpeg,339686590,https://www.airbnb.com/users/show/339686590,Shaylee,2020-03-01,"Bozeman, MT",,,,,f,https://a0.muscache.com/im/pictures/user/4c655aba-48ac-46f3-88a3-2c202c8cac9f.jpg?aki_policy=profile_small,https://a0.muscache.com/im/pictures/user/4c655aba-48ac-46f3-88a3-2c202c8cac9f.jpg?aki_policy=profile_x_medium,,1,1,"['email', 'phone']",t,t,,Bozeman,,45.68693,-111.04391,Entire condo,Entire home/apt,3,1.0,1 bath,1,1.0,"[""Refrigerator"", ""Hangers"", ""Carbon monoxide alarm"", ""Outdoor dining area"", ""Stainless steel oven"", ""Free parking on premises"", ""Microwave"", ""Wifi"", ""Clothing storage"", ""First aid kit"", ""Body soap"", ""Pack \u2019n play/Travel crib"", ""Cleaning products"", ""Extra pillows and blankets"", ""Fire extinguisher"", ""Keypad"", ""Hair dryer"", ""Bed linens"", ""Essentials"", ""EV charger"", ""Stainless steel gas stove"", ""Self check-in"", ""Freezer"", ""Dishwasher"", ""Dishes and silverware"", ""Coffee maker: drip coffee maker"", ""Elevator"", ""Free washer \u2013 In unit"", ""Central heating"", ""Wine glasses"", ""TV with Roku"", ""Dining table"", ""Iron"", ""Free dryer \u2013 In unit"", ""Hot water"", ""Conditioner"", ""Free street parking"", ""Smoke alarm"", ""Air conditioning"", ""Shampoo"", ""Kitchen""]",$186.00,30,90,30,30,1125,1125,30.0,1125.0,,t,30,60,90,365,2024-11-09,49,0,0,2021-12-29,2023-10-16,5.0,5.0,5.0,4.88,4.96,4.98,4.92,,t,1,1,0,0,1.4
262,53679965,https://www.airbnb.com/rooms/53679965,20241109184835,2024-11-09,city scrape,Private suite / Cali king bed / beautiful Bozeman,"Perfect place for your summer or winter trip to bozeman, MT. Private upstairs suite complete w full large bathroom . Brand new California king bed. Full service kitchen (shared). Minutes to all of downtown bozeman and the outdoors.  Enjoy plenty of outdoor seating and covered propane grilling! There is laundry upstairs as well as linens and toiletries fully provided.  We keep our RV in driveway so parking is just about a block away . If you have any other questions please ask prior to booking!",,https://a0.muscache.com/pictures/d10c0046-92c0-48da-b5e5-05e284ecc7b8.jpg,19442684,https://www.airbnb.com/users/show/19442684,John,2014-08-04,"Chicago, IL","I’m Glenn John, i am a pilot for amazon and I love to travel all over the world. Always up for house swapping opportunities. ",,,,f,https://a0.muscache.com/im/pictures/user/de18cc41-370c-4d87-a9b2-114cfee5f0ff.jpg?aki_policy=profile_small,https://a0.muscache.com/im/pictures/user/de18cc41-370c-4d87-a9b2-114cfee5f0ff.jpg?aki_policy=profile_x_medium,,1,3,"['email', 'phone']",t,t,,Bozeman,,45.67677,-111.07857,Private room in condo,Private room,2,1.0,1 shared bath,1,1.0,"[""Refrigerator"", ""Portable fans"", ""Hangers"", ""Outdoor dining area"", ""Outdoor furniture"", ""Wifi"", ""Mountain view"", ""Indoor fireplace"", ""Lockbox"", ""Body soap"", ""Coffee maker"", ""Cleaning products"", ""Extra pillows and blankets"", ""Free dryer"", ""BBQ grill"", ""Hair dryer"", ""Bed linens"", ""Essentials"", ""Self check-in"", ""Shower gel"", ""Dishes and silverware"", ""Dedicated workspace"", ""Clothing storage: closet"", ""Washer"", ""Central heating"", ""Iron"", ""Hot water"", ""Conditioner"", ""Smoke alarm"", ""Exercise equipment"", ""Cooking basics"", ""Private patio or balcony"", ""Shampoo"", ""Kitchen""]",$139.00,4,365,4,4,1125,1125,4.0,1125.0,,t,30,60,90,365,2024-11-09,41,0,0,2022-01-15,2023-09-25,4.8,4.76,4.85,4.85,4.88,4.83,4.78,STR45-46382,t,1,0,1,0,1.19
