135,40806022,https://www.airbnb.com/rooms/40806022,20241109184835,2024-11-09,city scrape,Cozy Apartment in Heart of Downtown!,"Enjoy this pristine clean, nostalgic 1960s basement apartment in a nice neighborhood within walking distance to midtown and downtown, bike/walking paths, numerous eateries, galleries, and shops.","This home is in the heart of Bozeman. 9 block walk to Down Town.<br /><br />Recommended hiking trails:<br />Sypes Canyon<br />The ""M"" Trail<br />Middle Cottonwood<br />Hyalite (any hikes) <br />Drinking Horse<br />Galligator Trail<br />Lava Lake<br />Pete's Hill<br />Bear Canyon<br /><br />Recommended Drinking Spots:<br />Feel free to take a growler or two to fill at one of our local craft breweries:<br /><br />The Bozeman Brewing Company. This is a great place to go after a day on the mountain or the river. The patrons are local. The owners and employees are friends. The beer is outstanding.<br /><br />Bridger Brewing is across town on campus and also one of our favorites. The pizza at Bridger Brewing is excellent.<br /><br />MAP brewing is a great place to have a beer.<br /><br />The dive bars are The Filler, The Eagles, The Crystal, and The Hauf. Each often feature live music. The Hauf has live music nightly.<br /><br />Plonk and the Open Range feature outstanding mixed drinks, wine",https://a0.muscache.com/pictures/miso/Hosting-40806022/original/5627ca01-e77c-4580-aead-358ab91efe15.jpeg,317251520,https://www.airbnb.com/users/show/317251520,Katie,2019-12-13,"Bozeman, MT",,within an hour,100%,100%,t,https://a0.muscache.com/im/pictures/user/User/original/8de57fee-5f29-4cb7-8fa8-98ee8633a24d.jpeg?aki_policy=profile_small,https://a0.muscache.com/im/pictures/user/User/original/8de57fee-5f29-4cb7-8fa8-98ee8633a24d.jpeg?aki_policy=profile_x_medium,,9,13,"['email', 'phone']",t,t,Neighborhood highlights,Bozeman,,45.6827,-111.04561,Entire rental unit,Entire home/apt,6,1.0,1 bath,3,4.0,"[""Radiant heating"", ""Refrigerator"", ""Private entrance"", ""Portable fans"", ""Hangers"", ""Laundromat nearby"", ""Carbon monoxide alarm"", ""Free parking on premises"", ""Microwave"", ""43 inch TV with Netflix, premium cable"", ""Mountain view"", ""Clothing storage"", ""Cleaning available during stay"", ""Drying rack for clothing"", ""First aid kit"", ""Pack \u2019n play/Travel crib"", ""Coffee maker"", ""Long term stays allowed"", ""Cleaning products"", ""Extra pillows and blankets"", ""BBQ grill"", ""Fire extinguisher"", ""Keypad"", ""Hair dryer"", ""Bed linens"", ""Essentials"", ""Self check-in"", ""Freezer"", ""Dishwasher"", ""Dishes and silverware"", ""Toaster"", ""Fast wifi \u2013 478 Mbps"", ""Baking sheet"", ""Free washer \u2013 In unit"", ""Dining table"", ""Oven"", ""Iron"", ""Free dryer \u2013 In unit"", ""Indoor fireplace: electric"", ""Coffee"", ""Hot water"", ""Conditioner"", ""Free street parking"", ""LG electric stove"", ""Smoke alarm"", ""Cooking basics"", ""Shampoo"", ""Kitchen""]",$90.00,30,1125,2,30,1125,1125,17.4,1125.0,,t,0,0,0,162,2024-11-09,200,45,0,2020-03-17,2024-09-01,4.72,4.76,4.71,4.9,4.89,4.87,4.65,STR23-00101,f,5,5,0,0,3.53
137,41296861,https://www.airbnb.com/rooms/41296861,20241109184835,2024-11-09,city scrape,Bozeman Family Home - Close to MSU | Very Clean.,"This 3 bedroom rancher home is a great place for families or those looking to stay near the heart of Bozeman. The home is 2 blocks from main street and close to grocery stores, restaurants, breweries, food trucks, downtown Bozeman, Bridger Bowl, MSU campus, and Main Street. The home is located in a very quiet neighborhood and is outfitted with premium bedding for a good night sleep. Our cleaners are top notch and disinfect and sanitize after each and every stay. STR20-00131","Our neighborhood is quiet and quaint. The Bridger Mtns can be seen to the northeast. Our street is safe, quiet,  and comfortable for people of all ages.",https://a0.muscache.com/pictures/miso/Hosting-41296861/original/c302c44e-12aa-4648-bd3b-8fae6c436e18.jpeg,32302835,https://www.airbnb.com/users/show/32302835,Sarah,2015-04-30,"Laurel, MT",,within an hour,100%,100%,t,https://a0.muscache.com/im/pictures/user/5a1d6cd0-58d3-4dc7-bc54-6aeef5a20568.jpg?aki_policy=profile_small,https://a0.muscache.com/im/pictures/user/5a1d6cd0-58d3-4dc7-bc54-6aeef5a20568.jpg?aki_policy=profile_x_medium,,7,9,"['email', 'phone']",t,t,Neighborhood highlights,Bozeman,,45.68151,-111.04976,Entire home,Entire home/apt,6,1.5,1.5 baths,3,4.0,"[""Refrigerator"", ""Luggage dropoff allowed"", ""Clothing storage: closet and dresser"", ""Portable fans"", ""Hangers"", ""Private entrance"", ""Laundromat nearby"", ""Carbon monoxide alarm"", ""Free parking on premises"", ""GE stainless steel electric stove"", ""Microwave"", ""Books and reading material"", ""Wifi"", ""Exterior security cameras on property"", ""First aid kit"", ""Body soap"", ""TV"", ""Long term stays allowed"", ""Cleaning products"", ""Fire extinguisher"", ""Keypad"", ""Hair dryer"", ""Bed linens"", ""Hot water kettle"", ""Essentials"", ""Coffee maker: pour-over coffee"", ""Self check-in"", ""Freezer"", ""Dishwasher"", ""Shower gel"", ""Dishes and silverware"", ""Toaster"", ""Heating"", ""Baking sheet"", ""Free washer \u2013 In unit"", ""Board games"", ""Wine glasses"", ""Dining table"", ""Oven"", ""Iron"", ""Free dryer \u2013 In unit"", ""Coffee"", ""Hot water"", ""Conditioner"", ""Pocket wifi"", ""Free street parking"", ""Smoke alarm"", ""Cooking basics"", ""Shampoo"", ""Kitchen""]",$166.00,2,1125,1,2,1125,1125,2.0,1125.0,,t,19,29,59,330,2024-11-09,226,29,0,2020-01-23,2024-10-04,4.82,4.85,4.95,4.94,4.9,4.88,4.71,STR20-00131,t,1,1,0,0,3.87
138,41430974,https://www.airbnb.com/rooms/41430974,20241109184835,2024-11-09,city scrape,Comfortable and Modern Bozeman Abode,"Situated on quiet street in the heart of Bozeman, minutes from downtown, with many options for dining, entertainment & shopping. This lovely place is a great home base!  Go enjoy the surrounding mountains and rivers, experience the Montana life style! Montana summers are fabulous & there are great day trip hikes in every direction. Montana winters are perfect for curling up with a good book … or go play in the snow!  SORRY NO PETS.  Sadly We had to change our policy due to damage.",This house is a 30 minute walk from the central old town area.  There are coffee shops within five minutes walk -Cold Smoke Coffee house - Starbucks etc.  Grocery shopping is also nearby.  Kirk Park is a beautiful park that is two blocks away.,https://a0.muscache.com/pictures/940d041e-2a94-43e5-93bc-1caf338b968e.jpg,222903364,https://www.airbnb.com/users/show/222903364,Debbie,2018-10-27,"Phoenix, AZ","Hello fellow travelers!  My husband and I love to travel and we love to stay in Airbnb’s.  
We realized that this is the best way to stay so in 2018 we set up a home in Phoenix  (where we live) so that our kids and our grandkids could have a place to stay when they come visit.  We also have a home in Montana, which is where I am from.  Much of my family still lives in Bozeman so we set up our home away from so we wouldn’t wear out our welcome when we come to visit!  Our Bozeman abode is beautiful and is located in the heart of the town.    We are very glad to be able to share our home away from home airbnb’s with you!
",within an hour,100%,99%,t,https://a0.muscache.com/im/pictures/user/c2d7ba2e-0683-4fdb-855f-2e96cbbcc85b.jpg?aki_policy=profile_small,https://a0.muscache.com/im/pictures/user/c2d7ba2e-0683-4fdb-855f-2e96cbbcc85b.jpg?aki_policy=profile_x_medium,,2,2,"['email', 'phone']",t,t,Neighborhood highlights,Bozeman,,45.68399,-111.06462,Entire home,Entire home/apt,6,1.0,1 bath,3,3.0,"[""Refrigerator"", ""Clothing storage: closet and dresser"", ""Coffee maker: Keurig coffee machine"", ""Hangers"", ""Private entrance"", ""Carbon monoxide alarm"", ""Children\u2019s books and toys"", ""Outdoor dining area"", ""Free parking on premises"", ""Microwave"", ""Outdoor furniture"", ""LG stainless steel electric stove"", ""Blender"", ""Mountain view"", ""Exterior security cameras on property"", ""First aid kit"", ""Body soap"", ""Long term stays allowed"", ""Cleaning products"", ""Extra pillows and blankets"", ""BBQ grill"", ""Fire extinguisher"", ""Keypad"", ""Barbecue utensils"", ""Hair dryer"", ""Bed linens"", ""Bathtub"", ""Essentials"", ""Self check-in"", ""Freezer"", ""Fast wifi \u2013 243 Mbps"", ""Shower gel"", ""Dishes and silverware"", ""Dedicated workspace"", ""Dishwasher"", ""Toaster"", ""Single level home"", ""Heating"", ""Baking sheet"", ""Free washer \u2013 In unit"", ""Board games"", ""Wine glasses"", ""Dining table"", ""Oven"", ""Iron"", ""Free dryer \u2013 In unit"", ""Crib"", ""Central air conditioning"", ""Hot water"", ""Ceiling fan"", ""Conditioner"", ""Coffee"", ""Free street parking"", ""Smoke alarm"", ""Cooking basics"", ""Private patio or balcony"", ""Shared backyard \u2013 Fully fenced"", ""55 inch HDTV with Roku, Chromecast, DVD player"", ""Shampoo"", ""Kitchen"", ""Room-darkening shades""]",$198.00,3,100,2,3,1125,1125,3.0,1125.0,,t,21,42,55,55,2024-11-09,141,15,1,2020-02-09,2024-10-14,4.94,4.97,4.9,4.97,4.93,4.94,4.88,STR23-00182,f,1,1,0,0,2.44
140,42330186,https://www.airbnb.com/rooms/42330186,20241109184835,2024-11-09,city scrape,The Gray Box! Downtown Apartment,"Brand new! Walking distance (5 blocks) to Main Street in Bozeman's Northeast Neighborhood. Walk to bars, restaurants, and shops. 4 blocks to the Gallatin County Fairgrounds, ice house, and carpool/shuttle lot to nearby Bridger Bowl. 2 miles to MSU campus. Very clean, comfortable, and well lit. Full and stocked kitchen. Washer and dryer. Queen sized comfortable bed. Full sized American Leather sofa bed (trust me, it's amazing!). Roku TV and WiFi.","We are 5 blocks from downtown Bozeman, close to breweries, cafes, restaurants, and shops. Northeast Bozeman is a great neighborhood that features several parks and hidden gems away from Main Street (including Bozeman Brewing Company!). If you feel like taking a hike, Peet's hill, The M trail, and Drinking Horse trail are all easy to access after a short drive.",https://a0.muscache.com/pictures/a6bd77f3-17f8-49ab-8a15-9851967004c6.jpg,80123200,https://www.airbnb.com/users/show/80123200,Heather,2016-06-26,"Bozeman, MT",,within an hour,100%,99%,t,https://a0.muscache.com/im/pictures/user/1376f021-6ad2-443f-998f-461948355a0f.jpg?aki_policy=profile_small,https://a0.muscache.com/im/pictures/user/1376f021-6ad2-443f-998f-461948355a0f.jpg?aki_policy=profile_x_medium,,2,2,"['email', 'phone']",t,t,Neighborhood highlights,Bozeman,,45.68531,-111.03714,Entire rental unit,Entire home/apt,4,1.0,1 bath,2,3.0,"[""Refrigerator"", ""Private entrance"", ""Hangers"", ""Carbon monoxide alarm"", ""Free parking on premises"", ""Microwave"", ""Wifi"", ""Stove"", ""Body soap"", ""TV"", ""Coffee maker"", ""Cleaning products"", ""Fire extinguisher"", ""Keypad"", ""Hair dryer"", ""Bathtub"", ""Dryer"", ""Essentials"", ""Window AC unit"", ""Self check-in"", ""Dishwasher"", ""Dishes and silverware"", ""Heating"", ""Washer"", ""Oven"", ""Hot water"", ""Conditioner"", ""Free street parking"", ""Smoke alarm"", ""Cooking basics"", ""Shampoo"", ""Kitchen""]",$139.00,1,1125,1,1,1125,1125,1.0,1125.0,,t,25,49,76,164,2024-11-09,400,92,2,2020-03-08,2024-10-20,4.97,4.97,4.97,4.96,4.98,4.98,4.91,str21-00025,f,1,1,0,0,7.03
141,42471467,https://www.airbnb.com/rooms/42471467,20241109184835,2024-11-09,city scrape,ADU | Stylish Guesthouse | Walk to Downtown!,"Your perfect Bozeman getaway awaits! This charming, architect-designed studio guesthouse is ideal for couples, offering everything you need for a short stay or an extended retreat. Enjoy radiant floor heating, a full-size bathtub, a washer and dryer, a dishwasher, a French press, and a spacious outdoor patio. We're dog-friendly (with a fee), and have a private fenced backyard for your pup to run around.<br /><br />*Dedicated workspace & WiFi<br />*Full kitchen<br />*Laundry <br />*Spacious bathroom<br />*Blocks from downtown","The guesthouse is located in a beautiful residential neighborhood, a half-mile from Main Street in Bozeman, 10 miles from Bozeman Airport, 16 miles from Bridger Bowl Ski Area, 45 miles from Big Sky, 85 miles to the north entrance to Yellowstone, and 90 miles to the west entrance to Yellowstone.<br /><br />Walk to downtown Bozeman where you’ll find cute coffee shops, great dining options, locally-owned boutiques, cool bars, and much more! <br /><br />Bozeman is known as “the most livable place” for good reason. Enjoy world-renowned fly fishing, and stunning mountains for hiking, mountain biking, rock climbing, skiing, hunting, and backcountry exploring. Yellowstone National Park and abundant wildlife are also nearby. Don’t miss out on Bozeman’s city experience - explore the vibrant arts and culture scene with main street festivals, farmers markets, cultural centers, museums, symphonies, theaters, and art galleries. <br />You're a walk or a bike ride away from downtown, the Cannery Distr",https://a0.muscache.com/pictures/prohost-api/Hosting-42471467/original/9c963286-f573-48f2-a51d-66c3c0a5a27b.jpeg,22366054,https://www.airbnb.com/users/show/22366054,Tessa,2014-10-10,"Bozeman, MT","Hi, I’m Tessa. Originally from Missouri, I’ve been in Bozeman since 2010. I'm a mom and Licensed Montana Property Manager (RRE-RPM-LIC-109282).  My husband, Sten, is an Architect. We adore Bozeman and love sharing it with our guests. We love hiking, biking, skiing, camping, riding motorcycles, traveling near and far, and meeting new people. We share our home with our two young children.",within an hour,100%,98%,t,https://a0.muscache.com/im/users/22366054/profile_pic/1412952918/original.jpg?aki_policy=profile_small,https://a0.muscache.com/im/users/22366054/profile_pic/1412952918/original.jpg?aki_policy=profile_x_medium,,17,19,"['email', 'phone', 'work_email']",t,t,Neighborhood highlights,Bozeman,,45.68469,-111.03912,Entire guesthouse,Entire home/apt,4,1.0,1 bath,1,2.0,"[""Children\u2019s dinnerware"", ""Radiant heating"", ""Refrigerator"", ""Private entrance"", ""Portable fans"", ""Hangers"", ""Kirkland Body Wash body soap"", ""Carbon monoxide alarm"", ""Outdoor dining area"", ""Free parking on premises"", ""Microwave"", ""Books and reading material"", ""Outdoor furniture"", ""Wifi"", ""Mountain view"", ""Pantene shampoo"", ""Pack \u2019n play/Travel crib"", ""Pets allowed"", ""Coffee maker"", ""Cleaning products"", ""Extra pillows and blankets"", ""BBQ grill"", ""Fire extinguisher"", ""Barbecue utensils"", ""Hair dryer"", ""Bed linens"", ""Bluetooth sound system"", ""Hot water kettle"", ""Bathtub"", ""Essentials"", ""Stainless steel gas stove"", ""Self check-in"", ""Freezer"", ""Pantene conditioner"", ""Shower gel"", ""Dishes and silverware"", ""Dedicated workspace"", ""Dishwasher"", ""Toaster"", ""Clothing storage: closet"", ""Baking sheet"", ""Free washer \u2013 In unit"", ""50 inch HDTV with Amazon Prime Video, Roku, Netflix"", ""Private backyard \u2013 Fully fenced"", ""Wine glasses"", ""Dining table"", ""Oven"", ""Iron"", ""Bikes"", ""Free dryer \u2013 In unit"", ""AC - split type ductless system"", ""Coffee"", ""Hot water"", ""Ceiling fan"", ""Free street parking"", ""Smoke alarm"", ""Cooking basics"", ""Private patio or balcony"", ""Keypad"", ""Kitchen"", ""Room-darkening shades""]",$189.00,2,1125,1,3,1125,1125,1.7,1125.0,,t,13,31,48,323,2024-11-09,279,27,4,2020-03-23,2024-10-30,4.97,4.97,4.96,4.99,4.97,4.97,4.85,STR21-00033,f,10,10,0,0,4.94
144,42913733,https://www.airbnb.com/rooms/42913733,20241109184835,2024-11-09,city scrape,Historic Bozeman Hideaway,"Enjoy this beautifully restored, one-bedroom, fully-furnished apartment within a house, with its own private entrance. Located in a quiet neighborhood, just a 6 min walk north of Main Street and an 8 min walk to Wild Crumb bakery.<br /><br />Fully-equipped kitchen with stainless fridge, gas stove, dishwasher, woodblock countertop.  Dining room table seats six. High speed wifi. Free onsite parking. Washer/dryer. Great space for reading and relaxing. Wooden floors with Moroccan rugs.","Amazing location: a five minute walk to Wild Crumb Bakery and Treeline Coffee, and mere steps from Mountains Walking and Bozeman Brewing. Endless trails nearby for walking, jogging, and biking. 20 min drive to Bridger Bowl and Crosscut Nordic Center.",https://a0.muscache.com/pictures/7fc91ad6-9fd3-4347-9f79-6f219e78577b.jpg,2209026,https://www.airbnb.com/users/show/2209026,Kristen,2012-04-24,"Bozeman, MT","Hello! I've been an airbnb host and traveler for many years. What I love most about Bozeman is the community... and of course enjoying the snow, hot springs, documentary films, great coffee, and tasty beer.  ",within an hour,90%,98%,t,https://a0.muscache.com/im/pictures/user/1b34c2d7-6fc4-40e9-8342-890f86d1c64c.jpg?aki_policy=profile_small,https://a0.muscache.com/im/pictures/user/1b34c2d7-6fc4-40e9-8342-890f86d1c64c.jpg?aki_policy=profile_x_medium,,3,6,"['email', 'phone', 'work_email']",t,t,Neighborhood highlights,Bozeman,,45.683712,-111.024773,Entire home,Entire home/apt,2,1.0,1 bath,1,1.0,"[""Refrigerator"", ""Clothing storage: closet and dresser"", ""Private entrance"", ""Hangers"", ""Carbon monoxide alarm"", ""Free parking on premises"", ""Microwave"", ""Books and reading material"", ""Wifi"", ""Mountain view"", ""Drying rack for clothing"", ""First aid kit"", ""Body soap"", ""Coffee maker"", ""Cleaning products"", ""Keypad"", ""Hair dryer"", ""Bed linens"", ""Hot water kettle"", ""Bathtub"", ""Essentials"", ""Window AC unit"", ""Self check-in"", ""Freezer"", ""Indoor fireplace: gas"", ""Shower gel"", ""Dishes and silverware"", ""Dedicated workspace"", ""Dishwasher"", ""Toaster"", ""Single level home"", ""Heating"", ""Free washer \u2013 In unit"", ""Frigidaire stainless steel gas stove"", ""Wine glasses"", ""Backyard"", ""Dining table"", ""Oven"", ""Iron"", ""Free dryer \u2013 In unit"", ""Coffee"", ""Hot water"", ""Conditioner"", ""Free street parking"", ""Smoke alarm"", ""Cooking basics"", ""Shampoo"", ""Kitchen"", ""Room-darkening shades""]",$199.00,30,365,30,30,365,365,30.0,365.0,,t,1,19,19,256,2024-11-09,95,7,0,2020-12-06,2024-09-12,4.97,4.98,4.98,4.97,5.0,4.94,4.92,,t,3,3,0,0,1.99
145,43516278,https://www.airbnb.com/rooms/43516278,20241109184835,2024-11-09,city scrape,Downtown Bungalow - side door,"Our Downtown Bungalow has the feel of a cottage in a quiet historic downtown neighborhood, two blocks from restaurants, pubs, shops, boutiques, groceries, historic theater, our beautiful library, parks, creeks, and walking trails. It is an ideal location for guests who are traveling through, college bound visitors, professors, students, skiers, bicyclers, families, etc. Guests without transportation are able to get around with ease to downtown, or walking distance to Montana State University.",,https://a0.muscache.com/pictures/96746096/14135dd3_original.jpg,26925375,https://www.airbnb.com/users/show/26925375,Loretta & Jack,2015-01-29,"Bozeman, MT","Welcome to Bozeman and our Downtown Bungalow with your own private entrance and lower level floor, two private bedrooms for individuals or groups, one with a queen bed, the other with one full and twin. There is a shared living room and beautiful bathroom with a Europen style shower, a kitchenette with refrigerator, microwave, utensils, coffee pot and tea kettle with ground coffee and teas. A bistro table and chairs await you in the garden for your use.
We are located on a quiet street, two blocks from Historic Main Street, restaurants, breweries, coffee shops, boutiques, Bogert Park with their Tuesday night Farmer's Market, a creek, outdoor pool, playground and the base of our amazing trail system from Main Street to the Mountains. We are walking distance to Montana State University, Museum of the Rockies, Bozeman High School, the Community Food Co-op, Bozeman Public Library, Bozeman Deaconess Hospital, and two blocks to our free bus service, including a free downtown shuttle to and from Bridger Bowl Ski Hill.

We are quite the artistic family.
Loretta is a fine artist and educator, muralist, gardener, and bicycler. She exhibits her paintings locally at Cello Gallery and teaches Art Workshops for Adults and children, including Plein Air Landscape Workshops,  Hike Bike Art Camp, plus Art and Sip Parties for all ages and occasions.
Jack is an architectural designer, historian, fine cook, and loves to read. 
He is a skier and hiker of our many local trails.
We love to travel and enjoy exploring nature.
We have two adult children in their twenties.
Our son is a writer and marketer for book publishing. Our daughter is a screen actress.
Our Moto:
Be Active. Explore Nature. Create Art.
",within an hour,100%,100%,t,https://a0.muscache.com/im/pictures/user/f9abdea3-67e7-43bc-9133-78b1f0659214.jpg?aki_policy=profile_small,https://a0.muscache.com/im/pictures/user/f9abdea3-67e7-43bc-9133-78b1f0659214.jpg?aki_policy=profile_x_medium,,2,2,"['email', 'phone']",t,t,,Bozeman,,45.67757,-111.03405,Entire guest suite,Entire home/apt,4,1.0,1 bath,2,3.0,"[""Refrigerator"", ""Coffee maker: Keurig coffee machine"", ""Private entrance"", ""Hangers"", ""Private backyard"", ""Carbon monoxide alarm"", ""Free parking on premises"", ""Microwave"", ""Books and reading material"", ""Wifi"", ""Body soap"", ""Cleaning products"", ""Extra pillows and blankets"", ""Fire extinguisher"", ""Hair dryer"", ""Hot water kettle"", ""Dryer"", ""Essentials"", ""Paid washer \u2013 In unit"", ""Self check-in"", ""Dishes and silverware"", ""Dedicated workspace"", ""Heating"", ""Wine glasses"", ""Iron"", ""Mini fridge"", ""Coffee"", ""Hot water"", ""Free street parking"", ""Smoke alarm"", ""Keypad"", ""Kitchen""]",$117.00,1,14,1,1,1125,1125,1.0,1125.0,,t,24,35,65,325,2024-11-09,346,76,6,2020-06-20,2024-11-05,4.79,4.81,4.93,4.97,4.89,4.95,4.68,STR23-00008,t,2,2,0,0,6.47
147,43689621,https://www.airbnb.com/rooms/43689621,20241109184835,2024-11-09,city scrape,Cozy upstairs apartment - 5 blocks from downtown,"License Number: STR22-00046.<br /><br />Second story apartment with large deck and living space. 5 minute walk to downtown shops and restaurants. We are about an hour and a half to two hours from two entrances to Yellowstone National Park. Private parking space and entrance off of the alley.  This unit has a full bathroom, full queen bedroom, and kitchenette. The owners live in the downstairs portion of the house with their baby and golden retriever.",5 minute walk to downtown Bozeman or the midtown area on 7th Ave.,https://a0.muscache.com/pictures/110c562d-ad38-4f6a-83ce-e7c51cd9f606.jpg,22056231,https://www.airbnb.com/users/show/22056231,Kelsey,2014-10-02,"Bozeman, MT","Hey there!  We are Kelsey and Zeph. We are Bozeman residents of 14 years, and we live in the main part of the house with our golden retriever and baby. We look forward to hosting you!",within an hour,100%,100%,t,https://a0.muscache.com/im/pictures/user/d24ac036-4798-43c7-b918-baad877dbef3.jpg?aki_policy=profile_small,https://a0.muscache.com/im/pictures/user/d24ac036-4798-43c7-b918-baad877dbef3.jpg?aki_policy=profile_x_medium,,2,2,"['email', 'phone']",t,f,Neighborhood highlights,Bozeman,,45.68364,-111.04161,Entire guest suite,Entire home/apt,2,1.0,1 bath,1,1.0,"[""Refrigerator"", ""Private entrance"", ""Portable fans"", ""Hangers"", ""Carbon monoxide alarm"", ""Free parking on premises"", ""Microwave"", ""Wifi"", ""Clothing storage"", ""First aid kit"", ""TV"", ""Cleaning products"", ""Extra pillows and blankets"", ""Fire extinguisher"", ""Hair dryer"", ""Bed linens"", ""Hot water kettle"", ""Bathtub"", ""Essentials"", ""Window AC unit"", ""Self check-in"", ""Freezer"", ""Dishes and silverware"", ""Coffee maker: drip coffee maker"", ""Toaster"", ""Heating"", ""Dining table"", ""Hot water"", ""Ceiling fan"", ""Free street parking"", ""Smoke alarm"", ""Cooking basics"", ""Private patio or balcony"", ""Keypad"", ""Kitchen""]",$128.00,2,1125,1,2,1125,1125,2.0,1125.0,,t,7,27,57,147,2024-11-09,239,50,5,2020-06-19,2024-11-06,4.92,4.94,4.95,4.97,4.98,4.92,4.85,STR22-00046,f,1,1,0,0,4.47
